locationRef,addressInMap,addressBuilding,addressStreet,addressCity,addressPostCode,addressStateProvince,addressCountry,lat,lng,descriptionOfActivities,ghgAssessmentInclusion,comment,subCode,tenantId
Image Personal,"171 Parker Knolls, North Crystal, Djibouti",171,Parker Knolls,North Crystal,85332,Montana,Djibouti,-43.3274545,129.652901,Do black nature cause quickly land article commercial protect.,partially-included,No comments,ZB-0159,686e08165310467dcf1eeab1
Young So,"71434 Carter Fork, North Pamelashire, Micronesia",71434,Carter Fork,North Pamelashire,19106,West Virginia,Micronesia,-40.193292,-5.532475,Word politics easy security.,included,No comments,cb-1405,686e08165310467dcf1eeab1
Smile Our,"94783 Morgan Field, South Ruthport, Swaziland",94783,Morgan Field,South Ruthport,76414,Arizona,Swaziland,17.932498,157.778211,Maintain opportunity force pattern today social.,included,Remain mission particularly teacher Mr.,Nb-7804,686e08165310467dcf1eeab1
Her Build,"92887 Jeffrey Crescent, Gentrymouth, Georgia",92887,Jeffrey Crescent,Gentrymouth,51569,West Virginia,Georgia,39.704989,-82.95444,Draw form quite.,included,Many conference near provide example alone lay.,ha-2266,686e08165310467dcf1eeab1
Gas Lay,"05379 Brown Plains, Port Claudiatown, Israel",05379,Brown Plains,Port Claudiatown,54575,Pennsylvania,Israel,-86.349779,76.626756,Southern son fire born maintain yourself international night morning.,included,No comments,VO-6379,686e08165310467dcf1eeab1
Offer Support,"889 Walton Turnpike, East Derrickburgh, Holy See (Vatican City State)",889,Walton Turnpike,East Derrickburgh,67781,Kansas,Holy See (Vatican City State),-25.357094,-131.192956,Summer baby let director.,excluded,No comments,oY-3145,686e08165310467dcf1eeab1
Control Subject,"8420 Melton Trail, Lake Kimshire, Sao Tome and Principe",8420,Melton Trail,Lake Kimshire,17810,Arizona,Sao Tome and Principe,83.083289,-138.654087,Town rather significant.,included,No comments,tj-5570,686e08165310467dcf1eeab1
Toward Scientist,"30781 Buck Lights, Andersonburgh, Uzbekistan",30781,Buck Lights,Andersonburgh,58975,Rhode Island,Uzbekistan,50.648422,-82.973027,Reveal west save place her.,included,No comments,nu-8602,686e08165310467dcf1eeab1
Network Seek,"43513 Duran Green, Port Paulfurt, Central African Republic",43513,Duran Green,Port Paulfurt,08412,Washington,Central African Republic,-13.6662885,49.437451,Against require part week strategy trouble laugh certainly.,excluded,No comments,KA-4188,686e08165310467dcf1eeab1
Turn Put,"962 Tanner Forge, Milesburgh, Yemen",962,Tanner Forge,Milesburgh,21229,Oklahoma,Yemen,-47.704104,-176.967072,Movie reason concern plant.,partially-included,No comments,qz-6341,686e08165310467dcf1eeab1
Plan Yard,"778 Cameron Junctions, East Jessicaview, Andorra",778,Cameron Junctions,East Jessicaview,06423,Kentucky,Andorra,-22.8215755,-163.277761,All close attorney in southern among.,included,No comments,gM-9590,686e08165310467dcf1eeab1
American Policy,"05268 Smith Course, Joneston, Netherlands",05268,Smith Course,Joneston,34520,Connecticut,Netherlands,-85.383239,-139.391681,Someone art able class.,partially-included,No comments,NG-4319,686e08165310467dcf1eeab1
Learn Worry,"949 Hudson Prairie, New Johnberg, Bermuda",949,Hudson Prairie,New Johnberg,76124,Pennsylvania,Bermuda,-52.609106,-129.845899,Take life accept ball rate.,included,No comments,Ot-3853,686e08165310467dcf1eeab1
New Put,"49441 Stanley Stream, Ruizborough, Benin",49441,Stanley Stream,Ruizborough,15754,North Carolina,Benin,58.6728065,-47.936795,Open factor fund region foot.,included,Before exactly plan manage.,eP-2021,686e08165310467dcf1eeab1
Foot While,"797 Karen Avenue, South Jenniferfurt, Marshall Islands",797,Karen Avenue,South Jenniferfurt,78828,Nevada,Marshall Islands,-77.6629515,179.761686,At call economy raise.,partially-included,Although each answer usually chair your prepare think start.,Cy-5204,686e08165310467dcf1eeab1
Threat Across,"80509 Casey Fort, Port Carlafurt, Iran",80509,Casey Fort,Port Carlafurt,53953,Minnesota,Iran,85.5788105,-15.758705,Feeling perhaps scientist bank down.,excluded,Many share experience idea.,Vj-8969,686e08165310467dcf1eeab1
Trade Speech,"22509 Hester Forest, Lake Mackenzie, Paraguay",22509,Hester Forest,Lake Mackenzie,49655,Wyoming,Paraguay,-83.2308245,-130.882934,Cup chance campaign kid management.,excluded,No comments,Bv-5914,686e08165310467dcf1eeab1
Each Memory,"58946 Shawna Green, Johnsonton, Botswana",58946,Shawna Green,Johnsonton,33263,Missouri,Botswana,8.269081,24.201813,Spring hand picture.,excluded,Quickly PM author up strong.,Al-7193,686e08165310467dcf1eeab1
Protect Pretty,"6758 Ryan Tunnel, East Mark, Puerto Rico",6758,Ryan Tunnel,East Mark,46936,Kansas,Puerto Rico,5.907328,72.875748,Nor world wonder.,excluded,No comments,db-0422,686e08165310467dcf1eeab1
Make Find,"07197 Cox Spring, Charlottehaven, China",07197,Cox Spring,Charlottehaven,67508,Georgia,China,-32.0377345,130.956702,Right lawyer research.,included,No comments,qj-6689,686e08165310467dcf1eeab1
Information Team,"0589 Jessica Mountain, Lake Jamesview, Azerbaijan",0589,Jessica Mountain,Lake Jamesview,01056,Delaware,Azerbaijan,6.934202,-120.371438,Court teacher concern its risk.,partially-included,No comments,or-7798,686e08165310467dcf1eeab1
Technology Today,"230 Ferguson Station, Lindaville, Faroe Islands",230,Ferguson Station,Lindaville,37673,Massachusetts,Faroe Islands,-65.8194165,-58.12782,Bed it voice start.,partially-included,Rather second specific ahead one key picture ball pull.,Vo-0040,686e08165310467dcf1eeab1
Media Thousand,"85168 Margaret Forest, Toddfort, Senegal",85168,Margaret Forest,Toddfort,09590,Idaho,Senegal,10.0707565,22.066444,Practice mission special chair.,excluded,No comments,yA-8797,686e08165310467dcf1eeab1
Word Network,"661 Casey Junction, New Jesse, Antigua and Barbuda",661,Casey Junction,New Jesse,28197,Wisconsin,Antigua and Barbuda,10.860637,7.128042,Message else home help home individual.,included,Site wind.,lb-7049,686e08165310467dcf1eeab1
On Contain,"51303 Christopher View, Port Nicoleview, Saint Barthelemy",51303,Christopher View,Port Nicoleview,98388,South Dakota,Saint Barthelemy,-73.435329,-53.847202,Court hold degree brother because.,included,No comments,wJ-3060,686e08165310467dcf1eeab1
Boy Need,"98287 Perez Courts, Lewishaven, Armenia",98287,Perez Courts,Lewishaven,15349,New Mexico,Armenia,89.0087735,108.047444,Boy sign would him write group blue.,partially-included,No comments,zt-8163,686e08165310467dcf1eeab1
Television Education,"897 Cristina Expressway, Karenborough, Equatorial Guinea",897,Cristina Expressway,Karenborough,93709,Idaho,Equatorial Guinea,-36.463216,-149.935133,Different book despite federal rate.,excluded,No comments,Mg-8857,686e08165310467dcf1eeab1
City Question,"851 Mcguire Falls, Leebury, Bangladesh",851,Mcguire Falls,Leebury,58392,New Hampshire,Bangladesh,39.774199,93.061975,Outside fund glass center wonder necessary.,partially-included,Key mission answer wife item affect.,Oc-1995,686e08165310467dcf1eeab1
The Peace,"1406 Johnson Station, Lake Coletown, Liechtenstein",1406,Johnson Station,Lake Coletown,11395,New York,Liechtenstein,68.5414385,53.983823,Item enter benefit.,included,No comments,TI-2891,686e08165310467dcf1eeab1
Some Style,"34938 Buchanan Lodge, North Carlton, Brazil",34938,Buchanan Lodge,North Carlton,81169,Wyoming,Brazil,-53.279226,-64.949549,Gas above religious relate garden.,partially-included,No comments,La-5238,686e08165310467dcf1eeab1
Buy List,"473 Cochran Camp, Kathyport, Heard Island and McDonald Islands",473,Cochran Camp,Kathyport,07871,New Mexico,Heard Island and McDonald Islands,-70.4889665,63.477897,Site as wrong live.,partially-included,No comments,PT-9929,686e08165310467dcf1eeab1
Lay Head,"79719 Jonathan Walk, East Richardland, Andorra",79719,Jonathan Walk,East Richardland,55636,Minnesota,Andorra,8.058356,9.367035,Enough source recently right.,excluded,No comments,Qt-6164,686e08165310467dcf1eeab1
Any Medical,"64219 Tammy Cove, Pamelaburgh, Ecuador",64219,Tammy Cove,Pamelaburgh,51492,South Dakota,Ecuador,31.5463405,-160.514629,Off likely nation never life rich various song unit.,included,No comments,Lp-4182,686e08165310467dcf1eeab1
Reach Finally,"628 Haney Locks, Sabrinaburgh, Sweden",628,Haney Locks,Sabrinaburgh,68941,Florida,Sweden,-61.042724,-134.077522,Direction rock use remain.,excluded,No comments,jE-4659,686e08165310467dcf1eeab1
Author Before,"1521 Jesse Drives, Lake Judy, Papua New Guinea",1521,Jesse Drives,Lake Judy,43676,Wyoming,Papua New Guinea,72.4406735,-24.780797,Number gun pass might ago industry.,excluded,No comments,Gh-1513,686e08165310467dcf1eeab1
Ten Remember,"7513 Kimberly Mount, Davisberg, Ireland",7513,Kimberly Mount,Davisberg,90779,New Jersey,Ireland,-67.880986,-83.304145,Friend perform always during involve second hour catch.,partially-included,Heart program middle organization small.,Pb-6169,686e08165310467dcf1eeab1
Box Pass,"869 Evans Causeway, Sellerstown, Tanzania",869,Evans Causeway,Sellerstown,61292,Nebraska,Tanzania,-28.1928175,-51.349073,Without report.,excluded,Nation free tax determine than audience suddenly left card.,dO-6543,686e08165310467dcf1eeab1
Something Event,"275 York Mills, East Shellyhaven, Jersey",275,York Mills,East Shellyhaven,34029,West Virginia,Jersey,40.138761,-48.624067,Whether perform read apply wall lawyer.,excluded,No comments,fx-8898,686e08165310467dcf1eeab1
Upon Every,"88663 Clark Crossroad, South Josephbury, Luxembourg",88663,Clark Crossroad,South Josephbury,79709,Maryland,Luxembourg,76.9536155,-102.879258,Eat including chance beyond prevent generation.,excluded,No comments,Ws-7309,686e08165310467dcf1eeab1
Order Ago,"2196 Valerie Lakes, Port Jeffery, Hong Kong",2196,Valerie Lakes,Port Jeffery,74401,Tennessee,Hong Kong,-22.949113,-46.027186,Sister player long employee statement relate hair beautiful.,excluded,No comments,kq-0336,686e08165310467dcf1eeab1
What Pretty,"196 Tyler Creek, Hendricksland, Antigua and Barbuda",196,Tyler Creek,Hendricksland,89726,Utah,Antigua and Barbuda,-77.652816,139.47764,Source away produce.,excluded,No comments,VM-2463,686e08165310467dcf1eeab1
Mission But,"17418 Brooke Haven, New Patrick, Albania",17418,Brooke Haven,New Patrick,52535,Arkansas,Albania,3.989544,10.634243,Gun walk technology professor.,excluded,Meet now front yourself election pretty.,FQ-0294,686e08165310467dcf1eeab1
Chair Able,"006 John Island, Port Ellenshire, Turkmenistan",006,John Island,Port Ellenshire,82265,Tennessee,Turkmenistan,37.379361,-30.15173,Lose material listen business cultural phone factor less play.,included,Land skin pattern along include create.,vw-8612,686e08165310467dcf1eeab1
Wish Personal,"142 Brandon Way, Ashleychester, Namibia",142,Brandon Way,Ashleychester,29703,Wisconsin,Namibia,-86.8292095,-107.059224,Adult industry medical operation they buy.,included,No comments,CG-9825,686e08165310467dcf1eeab1
Its Society,"7668 Hill Branch, Davehaven, Lesotho",7668,Hill Branch,Davehaven,89336,Nebraska,Lesotho,-4.1280305,-150.906593,Be past order manager.,included,No comments,ku-0437,686e08165310467dcf1eeab1
Rate Article,"943 Hernandez Extensions, East Zacharychester, Saudi Arabia",943,Hernandez Extensions,East Zacharychester,67306,West Virginia,Saudi Arabia,-80.7238275,-150.768483,Or successful public.,excluded,No comments,Ec-8752,686e08165310467dcf1eeab1
South Television,"205 Eileen Fork, Lake Joshua, Malaysia",205,Eileen Fork,Lake Joshua,54030,Missouri,Malaysia,31.3397205,110.374071,Specific various right culture recent care nothing.,excluded,No comments,Na-0347,686e08165310467dcf1eeab1
Woman Memory,"68674 Alyssa Spring, North Duanetown, Palau",68674,Alyssa Spring,North Duanetown,08798,Pennsylvania,Palau,-21.5686335,17.584186,Son cold business knowledge music deep company mouth data.,partially-included,No comments,BZ-0422,686e08165310467dcf1eeab1
Focus Agreement,"956 Howard Turnpike, Haroldfurt, Aruba",956,Howard Turnpike,Haroldfurt,47237,Wisconsin,Aruba,56.3816605,77.974049,Identify consider gun answer major blood year likely week.,excluded,Policy dog save house.,ud-3313,686e08165310467dcf1eeab1
Current Him,"12935 Riggs Brooks, East Jonathan, Nepal",12935,Riggs Brooks,East Jonathan,03802,Utah,Nepal,13.686495,154.420724,Despite least in local.,excluded,No comments,Gc-4020,686e08165310467dcf1eeab1
Republican Board,"880 Katrina Stravenue, Stokestown, Argentina",880,Katrina Stravenue,Stokestown,74622,South Dakota,Argentina,14.9585835,-53.915197,Chance west start white theory next risk scientist reduce.,included,No comments,Ds-7272,686e08165310467dcf1eeab1
Body Accept,"0309 Gonzalez Forest, Markport, Seychelles",0309,Gonzalez Forest,Markport,27518,Utah,Seychelles,52.390457,41.708342,Child western avoid toward usually prepare big century you.,included,No comments,FS-9990,686e08165310467dcf1eeab1
Or Politics,"63154 Li Meadows, Lake Kimberlymouth, Germany",63154,Li Meadows,Lake Kimberlymouth,79931,Vermont,Germany,50.72043,11.34046,Road reflect evening weight political conference message.,partially-included,No comments,lZ-9720,686e08165310467dcf1eeab1
Player Guess,"57438 Harry Way, North Dale, Barbados",57438,Harry Way,North Dale,86115,Vermont,Barbados,-23.690931,52.676918,Pick wonder season movie write ok claim get.,included,No comments,Vk-3188,686e08165310467dcf1eeab1
Speak Cause,"875 Jones Mill, North Danielport, Haiti",875,Jones Mill,North Danielport,57907,North Dakota,Haiti,86.097357,-91.988982,City power impact bit note.,excluded,No comments,GV-3902,686e08165310467dcf1eeab1
Fast Something,"596 Walter Views, Loganview, Cocos (Keeling) Islands",596,Walter Views,Loganview,24482,Delaware,Cocos (Keeling) Islands,-71.3825015,-146.22461,Policy pressure condition husband strong line could see feel treatment.,included,No comments,ak-9817,686e08165310467dcf1eeab1
Their Hold,"76397 Mary Crossroad, North Daniel, Sao Tome and Principe",76397,Mary Crossroad,North Daniel,18099,Alaska,Sao Tome and Principe,-36.997407,160.431518,Machine plant move.,excluded,Fill real defense international accept stand.,PM-7419,686e08165310467dcf1eeab1
Including Thing,"190 Hurley Row, New Cindy, Solomon Islands",190,Hurley Row,New Cindy,44799,Florida,Solomon Islands,25.4105855,177.187565,Idea wonder force young town doctor effect often energy.,excluded,No comments,TV-9317,686e08165310467dcf1eeab1
Sure Receive,"5704 Carter Camp, Lake Sandramouth, Nauru",5704,Carter Camp,Lake Sandramouth,30287,Tennessee,Nauru,-27.640442,-8.8396,Answer avoid amount question answer nice safe.,included,No comments,wx-5821,686e08165310467dcf1eeab1
Lot Strategy,"3286 Katelyn Run, South Christian, Netherlands Antilles",3286,Katelyn Run,South Christian,49212,Washington,Netherlands Antilles,-14.885899,-154.366373,Size success budget.,partially-included,No comments,NX-1682,686e08165310467dcf1eeab1
Yourself Music,"184 Michael Mountains, New Allison, Saint Vincent and the Grenadines",184,Michael Mountains,New Allison,31181,Virginia,Saint Vincent and the Grenadines,-10.344939,83.279296,Culture fire always team.,included,No comments,wg-7140,686e08165310467dcf1eeab1
Tough Avoid,"292 Lisa Creek, East Juanhaven, Uruguay",292,Lisa Creek,East Juanhaven,24831,North Dakota,Uruguay,48.883532,-135.844135,Late sure morning law wide.,excluded,No comments,go-9532,686e08165310467dcf1eeab1
Doctor Game,"27343 Villegas Courts, Ryanhaven, Saint Kitts and Nevis",27343,Villegas Courts,Ryanhaven,99626,Connecticut,Saint Kitts and Nevis,10.051843,-2.893805,Exactly here three start.,excluded,Serve during style election task morning.,TL-8338,686e08165310467dcf1eeab1
Challenge Soldier,"368 Cobb Canyon, Codyville, Lithuania",368,Cobb Canyon,Codyville,41602,Vermont,Lithuania,28.9992045,-22.445411,Minute impact teacher few trial.,partially-included,No comments,Gz-3042,686e08165310467dcf1eeab1
Process Ten,"447 Ho Mill, Lake Eric, Israel",447,Ho Mill,Lake Eric,55160,Oklahoma,Israel,-59.0684315,-21.441806,Lawyer ready light.,partially-included,No comments,wy-0195,686e08165310467dcf1eeab1
Million Attention,"160 Hannah Divide, Kevinhaven, Latvia",160,Hannah Divide,Kevinhaven,39973,Vermont,Latvia,30.632938,170.230056,Own expect account.,excluded,No comments,tq-5383,686e08165310467dcf1eeab1
Set Sell,"4960 Jensen Lakes, North Sara, Christmas Island",4960,Jensen Lakes,North Sara,92279,South Dakota,Christmas Island,33.653414,-47.531007,Interesting fire administration including social all may movement because market.,partially-included,Travel if film change these us theory.,GB-9252,686e08165310467dcf1eeab1
Three May,"2606 Bennett Mountains, Lake Cynthia, Dominican Republic",2606,Bennett Mountains,Lake Cynthia,43864,Michigan,Dominican Republic,14.1514445,15.373329,Environmental up in operation heart stuff among.,included,No comments,Vs-2945,686e08165310467dcf1eeab1
Night Gun,"75251 Cunningham Circles, South Stephanieside, South Africa",75251,Cunningham Circles,South Stephanieside,03422,Montana,South Africa,13.731793,-101.669378,Such purpose with support artist.,included,No comments,co-0333,686e08165310467dcf1eeab1
Develop On,"4348 Marcus Trace, Taylorstad, Timor-Leste",4348,Marcus Trace,Taylorstad,78168,Idaho,Timor-Leste,-80.1944345,-43.919986,Soldier culture ability little picture other drug.,included,Within question nation exactly account.,jn-3414,686e08165310467dcf1eeab1
Father Enter,"961 Sandra Keys, Lake Jasmine, Yemen",961,Sandra Keys,Lake Jasmine,12763,Arizona,Yemen,-18.786666,78.407675,Line because local fire.,partially-included,No comments,Ka-6181,686e08165310467dcf1eeab1
Go Dream,"507 Melton Ford, Walkerhaven, Tajikistan",507,Melton Ford,Walkerhaven,09150,Kansas,Tajikistan,82.0307595,-122.60281,Story whom people follow card.,partially-included,No comments,kB-6964,686e08165310467dcf1eeab1
Forward Truth,"5404 Jones Prairie, North Bethborough, Antarctica (the territory South of 60 deg S)",5404,Jones Prairie,North Bethborough,10255,North Dakota,Antarctica (the territory South of 60 deg S),-74.7666725,167.802188,Chair billion in.,partially-included,No comments,Hc-8548,686e08165310467dcf1eeab1
Tree Cost,"7166 Scott Causeway, New Natalieton, Gibraltar",7166,Scott Causeway,New Natalieton,03957,California,Gibraltar,-38.499924,-165.78478,Speech concern strategy high force past.,included,No comments,CE-5640,686e08165310467dcf1eeab1
Defense Physical,"291 Clements Road, East Anne, Guinea-Bissau",291,Clements Road,East Anne,14506,Kansas,Guinea-Bissau,-42.8907595,82.969056,Always election speak home site whose today wrong away open.,excluded,No comments,YE-6758,686e08165310467dcf1eeab1
Together Relationship,"805 Jonathan Courts, Lake Stephanie, Burundi",805,Jonathan Courts,Lake Stephanie,36747,Illinois,Burundi,-69.44601,22.492995,Trouble article design approach doctor.,excluded,Create piece.,SW-2260,686e08165310467dcf1eeab1
Lead Until,"150 Casey Vista, Lake Kristybury, Tonga",150,Casey Vista,Lake Kristybury,90136,Rhode Island,Tonga,-26.9204385,134.818986,Whom opportunity go increase.,included,No comments,fY-2157,686e08165310467dcf1eeab1
Day Take,"0493 George Parkway, Olsenfurt, Kyrgyz Republic",0493,George Parkway,Olsenfurt,59450,Washington,Kyrgyz Republic,-29.5599,-167.080351,Operation also test question rock.,partially-included,No comments,KT-6433,686e08165310467dcf1eeab1
Standard Turn,"3392 Melissa Gateway, Lake Ericfurt, Sri Lanka",3392,Melissa Gateway,Lake Ericfurt,36356,Texas,Sri Lanka,-11.684641,-11.526144,Cover career cause bar mind.,included,No comments,cQ-6307,686e08165310467dcf1eeab1
Music Trade,"549 Ryan Street, East Andrewfurt, Belarus",549,Ryan Street,East Andrewfurt,40790,Illinois,Belarus,-60.67899,-32.634159,Skill down.,partially-included,No comments,RU-5453,686e08165310467dcf1eeab1
When Campaign,"2946 Michele Row, Lake Chadborough, Cocos (Keeling) Islands",2946,Michele Row,Lake Chadborough,22239,Wyoming,Cocos (Keeling) Islands,-79.149157,-127.204758,System term authority picture today of few foreign account black.,excluded,No comments,Ai-6900,686e08165310467dcf1eeab1
Race Challenge,"958 Smith Loaf, Port Dylanshire, British Virgin Islands",958,Smith Loaf,Port Dylanshire,95666,North Dakota,British Virgin Islands,75.159349,-165.824245,Section probably new because.,excluded,No comments,xu-1874,686e08165310467dcf1eeab1
Behind Too,"197 Ramirez Glens, Roseland, Ireland",197,Ramirez Glens,Roseland,50562,Michigan,Ireland,46.5466165,130.922827,Main during assume across race start game.,excluded,No comments,Wt-5058,686e08165310467dcf1eeab1
Final Project,"9377 Johnson Viaduct, New Steventon, Grenada",9377,Johnson Viaduct,New Steventon,95623,North Carolina,Grenada,88.48783,-170.708719,North share front manage.,excluded,No comments,kv-8958,686e08165310467dcf1eeab1
Thought It,"0814 Gabriella Station, Allenview, Bahrain",0814,Gabriella Station,Allenview,97014,Iowa,Bahrain,86.432787,175.095854,Develop born very.,included,No comments,NB-1813,686e08165310467dcf1eeab1
Street Cause,"70707 Caldwell Garden, Nataliefort, Monaco",70707,Caldwell Garden,Nataliefort,74406,South Dakota,Monaco,-5.896121,71.18252,Game however interview mother unit.,partially-included,Question worry sort science color hospital understand hold.,Lg-5786,686e08165310467dcf1eeab1
Soon Development,"75079 Michael Prairie, Ronaldshire, Syrian Arab Republic",75079,Michael Prairie,Ronaldshire,97133,Tennessee,Syrian Arab Republic,-30.2332855,99.77268,Listen network.,partially-included,No comments,Jj-7658,686e08165310467dcf1eeab1
Message Money,"96261 Haley Plains, Alexanderview, Lithuania",96261,Haley Plains,Alexanderview,94792,Mississippi,Lithuania,5.6009305,-102.883757,Clear toward phone couple Democrat happy former.,included,No comments,sR-7819,686e08165310467dcf1eeab1
Against Huge,"01524 Eric Radial, West Michael, Bahrain",01524,Eric Radial,West Michael,75576,Kansas,Bahrain,43.7626565,-156.52722,Magazine cultural billion available.,excluded,No comments,Vw-0946,686e08165310467dcf1eeab1
Pay Operation,"09226 Frank Dale, Sandraport, Thailand",09226,Frank Dale,Sandraport,23758,Hawaii,Thailand,-85.559135,-133.965087,Which then energy.,partially-included,Wind world example either.,VF-0696,686e08165310467dcf1eeab1
Affect Management,"635 Calhoun Rue, Williamchester, Cyprus",635,Calhoun Rue,Williamchester,36809,Hawaii,Cyprus,82.0231415,59.436936,Can them particular item college.,partially-included,Middle process much sense hold draw response here.,yT-6522,686e08165310467dcf1eeab1
Blood Certain,"41586 Copeland Island, East Victorside, Niue",41586,Copeland Island,East Victorside,99342,North Carolina,Niue,68.878549,-78.599368,Onto treatment.,included,No comments,Cm-0893,686e08165310467dcf1eeab1
Would Security,"452 William Ridges, North Kellystad, Gabon",452,William Ridges,North Kellystad,74284,Colorado,Gabon,64.7825665,-123.10404,Term group rich.,partially-included,No comments,GL-5974,686e08165310467dcf1eeab1
Bar Truth,"7426 Salazar Course, Teresamouth, Japan",7426,Salazar Course,Teresamouth,51946,Arizona,Japan,21.2075385,177.37645,Face born.,excluded,No comments,fS-2700,686e08165310467dcf1eeab1
Free Thousand,"74794 Mcneil Trafficway, New Julie, Antigua and Barbuda",74794,Mcneil Trafficway,New Julie,85674,Indiana,Antigua and Barbuda,-15.222103,-28.747837,Though town represent pay those education ok fire.,excluded,Bit season Mrs citizen relationship movement important.,Uv-4537,686e08165310467dcf1eeab1
Time Model,"0791 Walter Junctions, Mccartyfort, Costa Rica",0791,Walter Junctions,Mccartyfort,14728,Nebraska,Costa Rica,-76.9415935,-1.375763,Walk adult deep who return full public listen black.,excluded,Health system key onto into stuff college six.,nH-5349,686e08165310467dcf1eeab1
Draw Nation,"057 Michael Underpass, Woodport, Northern Mariana Islands",057,Michael Underpass,Woodport,10139,Nevada,Northern Mariana Islands,-32.7049715,35.319622,Box sister her back.,partially-included,Small price capital.,WP-7541,686e08165310467dcf1eeab1
Suddenly Song,"3603 Alex Road, East Robinberg, Martinique",3603,Alex Road,East Robinberg,15839,New York,Martinique,-47.000699,-35.175398,Mind dream if view property kitchen try month.,excluded,They sister together house room note.,sD-3362,686e08165310467dcf1eeab1
Common Arm,"09104 Anthony Prairie, Dunnshire, Anguilla",09104,Anthony Prairie,Dunnshire,62282,Connecticut,Anguilla,-89.8327225,35.922023,Ground condition Mr feeling.,included,No comments,MQ-7001,686e08165310467dcf1eeab1
To Continue,"5865 Amber Ports, New Melissastad, Montenegro",5865,Amber Ports,New Melissastad,65859,Delaware,Montenegro,72.142668,53.790109,Give safe act.,excluded,No comments,Sk-4497,686e08165310467dcf1eeab1
Miss Over,"5489 Simpson Shore, Port Jeffreymouth, Lao People's Democratic Republic",5489,Simpson Shore,Port Jeffreymouth,15551,Michigan,Lao People's Democratic Republic,-87.9139645,170.785151,Could cause prevent.,excluded,No comments,fO-1172,686e08165310467dcf1eeab1
Very Bank,"908 Michael Fords, Port Vincentland, Nigeria",908,Michael Fords,Port Vincentland,07717,Tennessee,Nigeria,-24.359622,44.93511,Environmental push majority meet rule.,included,Congress shoulder may site notice machine significant west respond.,eh-7150,686e08165310467dcf1eeab1
Ground Civil,"840 Kyle Overpass, New Veronicashire, Tuvalu",840,Kyle Overpass,New Veronicashire,70182,Michigan,Tuvalu,7.0108305,18.746508,Deep my plan fund provide option.,excluded,No comments,xf-0747,686e08165310467dcf1eeab1
Woman Best,"27266 Rivera Wells, Williamschester, Equatorial Guinea",27266,Rivera Wells,Williamschester,14278,New York,Equatorial Guinea,28.1936355,-30.987087,In put include cell feeling.,included,No comments,Ov-4927,686e08165310467dcf1eeab1
General Human,"756 Merritt Forks, Hernandezberg, Antigua and Barbuda",756,Merritt Forks,Hernandezberg,18169,Michigan,Antigua and Barbuda,48.2744245,73.750669,Body billion tax same compare deal.,included,No comments,oP-7338,686e08165310467dcf1eeab1
