locationRef,addressInMap,addressBuilding,addressStreet,addressCity,addressPostCode,addressStateProvince,addressCountry,lat,lng,descriptionOfActivities,ghgAssessmentInclusion,comment,subCode,tenantId
Beautiful Third,"66537 Cynthia Mills, East Megan, Botswana",66537,Cynthia Mills,East Megan,30016,Vermont,Botswana,-54.506985,-89.234075,Laugh back analysis class door recent dog tonight.,included,No comments,HK-8819,686e08165310467dcf1eeab1
Alone Seek,"939 Blair Street, East Dana, Venezuela",939,Blair Street,East Dana,03372,New York,Venezuela,-50.136731,-156.138325,Season have somebody table state character.,excluded,No comments,Wu-5427,686e08165310467dcf1eeab1
Deep Out,"6489 Horne Oval, Whiteside, Uzbekistan",6489,Horne Oval,Whiteside,13675,Delaware,Uzbekistan,86.4587625,-103.958952,Purpose garden I.,partially-included,Point final over.,qY-4119,686e08165310467dcf1eeab1
Tonight Clear,"1422 Paul Canyon, Rickyville, Swaziland",1422,Paul Canyon,Rickyville,36614,Iowa,Swaziland,53.9803335,-161.799945,Certain success production indicate.,excluded,No comments,lh-6146,686e08165310467dcf1eeab1
Economy Sense,"1444 Paul Greens, South Sarah, Romania",1444,Paul Greens,South Sarah,26795,Utah,Romania,10.020868,-44.943714,Despite computer score.,excluded,Turn head education within.,RG-3908,686e08165310467dcf1eeab1
Use Our,"882 Lori Islands, Port Johnville, France",882,Lori Islands,Port Johnville,46899,Nebraska,France,45.51667,4.86667,Natural action.,excluded,No comments,kf-3903,686e08165310467dcf1eeab1
American Success,"5462 Morris Avenue, South Cynthia, Cameroon",5462,Morris Avenue,South Cynthia,86998,Arkansas,Cameroon,-60.3304595,41.065211,International time care explain.,partially-included,No comments,nY-2738,686e08165310467dcf1eeab1
Activity Happen,"65114 Reilly Forks, East Ricky, Lesotho",65114,Reilly Forks,East Ricky,35559,California,Lesotho,2.592637,165.109854,With.,partially-included,No comments,eJ-2143,686e08165310467dcf1eeab1
Loss Republican,"684 Murphy Drives, Destinyport, Qatar",684,Murphy Drives,Destinyport,04198,New York,Qatar,68.4144985,11.554083,Attorney as dream.,included,No comments,Yt-6773,686e08165310467dcf1eeab1
Way Not,"6794 Hamilton Camp, East Jonton, Argentina",6794,Hamilton Camp,East Jonton,98236,Mississippi,Argentina,-46.994686,-77.762081,Question modern customer picture.,excluded,Late oil administration should fire order room.,DF-4247,686e08165310467dcf1eeab1
Huge Expert,"4495 Gray Loaf, Brownshire, Central African Republic",4495,Gray Loaf,Brownshire,13747,Alaska,Central African Republic,73.2408065,-170.408723,Media security day.,included,No comments,hc-8157,686e08165310467dcf1eeab1
Garden Speak,"9510 Natasha Freeway, Coxburgh, Guam",9510,Natasha Freeway,Coxburgh,23489,Connecticut,Guam,29.707631,60.222771,Citizen term Mrs type full station during once.,excluded,No comments,KP-5355,686e08165310467dcf1eeab1
Theory It,"260 Julia Knolls, Saundersshire, Jamaica",260,Julia Knolls,Saundersshire,82089,West Virginia,Jamaica,-61.0335205,41.844904,Matter community identify energy exactly.,partially-included,No comments,hY-7382,686e08165310467dcf1eeab1
Improve Kitchen,"813 Kimberly Island, North Sara, Tunisia",813,Kimberly Island,North Sara,34408,Arkansas,Tunisia,-54.540336,29.777638,Choice clearly media education.,excluded,No comments,tB-0136,686e08165310467dcf1eeab1
Southern Little,"420 Shaffer Via, New Melaniebury, Wallis and Futuna",420,Shaffer Via,New Melaniebury,32662,Wisconsin,Wallis and Futuna,0.8583375,37.23063,Instead hospital away.,included,Moment subject they resource.,OZ-1821,686e08165310467dcf1eeab1
Agree Young,"4870 Amy Views, Hawkinsstad, Belgium",4870,Amy Views,Hawkinsstad,19740,Louisiana,Belgium,-25.0610145,-131.917706,I enough bed true score.,included,Force they head.,IB-3681,686e08165310467dcf1eeab1
Discuss But,"674 Lisa Dam, Hammondview, Hong Kong",674,Lisa Dam,Hammondview,67856,Delaware,Hong Kong,-6.220646,3.205932,Scene her.,partially-included,No comments,wG-3813,686e08165310467dcf1eeab1
Happy After,"392 Nicole Glen, West Destinyland, South Georgia and the South Sandwich Islands",392,Nicole Glen,West Destinyland,60535,Maryland,South Georgia and the South Sandwich Islands,-57.984512,3.503826,Population agree candidate.,partially-included,No comments,lb-8826,686e08165310467dcf1eeab1
Situation Term,"962 Ray Cape, Robertshaven, Brazil",962,Ray Cape,Robertshaven,37444,Ohio,Brazil,-23.5412705,71.763038,Baby box she parent again themselves.,partially-included,No comments,sU-8374,686e08165310467dcf1eeab1
Box Friend,"9544 Raymond Path, Grayfurt, Vanuatu",9544,Raymond Path,Grayfurt,44949,Maryland,Vanuatu,2.4036515,-78.360154,Become sort.,excluded,Will might TV time among decide federal.,Ot-4044,686e08165310467dcf1eeab1
Hundred Need,"54024 Graves Springs, Lopezton, Sweden",54024,Graves Springs,Lopezton,82300,Wyoming,Sweden,-10.1042095,51.79913,Similar mission return.,excluded,Pretty perform imagine word.,Oe-6125,686e08165310467dcf1eeab1
Foot Room,"29426 Chan Plains, West Nathan, Croatia",29426,Chan Plains,West Nathan,29208,Vermont,Croatia,-30.3990715,-43.391191,Best majority service hotel reduce.,included,No comments,Oh-3415,686e08165310467dcf1eeab1
Field Particularly,"24042 Harper Glen, Sandrabury, Switzerland",24042,Harper Glen,Sandrabury,54103,Rhode Island,Switzerland,70.8279155,46.18175,Local government.,partially-included,Practice oil source different college city buy light.,gD-5346,686e08165310467dcf1eeab1
Line Democratic,"592 Tommy View, Markbury, Vietnam",592,Tommy View,Markbury,90690,Pennsylvania,Vietnam,-67.46471,-90.161699,Create much must now gun two perform soon.,included,No comments,Zb-0967,686e08165310467dcf1eeab1
Entire Mission,"2686 Evelyn Street, Toddside, Egypt",2686,Evelyn Street,Toddside,25801,Oregon,Egypt,-47.4321005,-29.179431,Bad scientist use.,included,No comments,rP-7962,686e08165310467dcf1eeab1
Near Everybody,"4553 Ronald Lane, Butlerfort, Ukraine",4553,Ronald Lane,Butlerfort,48274,Montana,Ukraine,10.9660455,-69.995573,Him especially take feeling yeah body happen hand.,excluded,No comments,Yv-8495,686e08165310467dcf1eeab1
Them Natural,"76406 Robert Shores, New Justinville, Iran",76406,Robert Shores,New Justinville,08805,Maryland,Iran,88.2099655,-163.78238,Structure figure those.,partially-included,No comments,mZ-2748,686e08165310467dcf1eeab1
Space Talk,"54077 Ashley Ramp, South Monica, Latvia",54077,Ashley Ramp,South Monica,98830,Tennessee,Latvia,63.0761665,62.065588,Business tough level example fear year effect field security.,included,Actually eat.,hz-1974,686e08165310467dcf1eeab1
Clear Ever,"03542 Rhonda Burg, Port Theresa, Kuwait",03542,Rhonda Burg,Port Theresa,68874,Nevada,Kuwait,-24.5455995,-120.212899,Ground enough often throw.,included,No comments,Fq-4008,686e08165310467dcf1eeab1
Start Operation,"230 Herrera Ford, Port Cynthiafort, Sierra Leone",230,Herrera Ford,Port Cynthiafort,67317,California,Sierra Leone,77.2257515,-66.608363,Audience determine spend morning.,partially-included,No comments,ma-5875,686e08165310467dcf1eeab1
Fine Size,"3564 Ann Glens, South Thomaston, Montserrat",3564,Ann Glens,South Thomaston,05710,Wyoming,Montserrat,33.1074835,59.618007,Fish want current.,excluded,No comments,Uo-9913,686e08165310467dcf1eeab1
Road Follow,"04218 Nathan Harbors, Port Kristin, Bolivia",04218,Nathan Harbors,Port Kristin,88155,Connecticut,Bolivia,-61.6934245,27.068329,Institution draw.,included,No comments,ID-3901,686e08165310467dcf1eeab1
Parent Image,"555 John Courts, Port Lisa, Cape Verde",555,John Courts,Port Lisa,42015,Virginia,Cape Verde,-25.0589335,-87.599907,Professor reflect example effort anyone lot money approach ability.,included,No comments,Br-1822,686e08165310467dcf1eeab1
Hit Successful,"085 Sarah View, Adkinshaven, Montenegro",085,Sarah View,Adkinshaven,94835,Oregon,Montenegro,54.657701,38.215472,Star yes just idea long.,excluded,No comments,Yk-7341,686e08165310467dcf1eeab1
Sometimes Bit,"311 Tammy Pine, Jimenezfurt, Latvia",311,Tammy Pine,Jimenezfurt,44942,Alabama,Latvia,-66.927447,46.633072,House station rather clear product off area court during.,included,No comments,CL-7891,686e08165310467dcf1eeab1
Reality Perhaps,"922 Ramirez Views, Barbarabury, Wallis and Futuna",922,Ramirez Views,Barbarabury,32175,Ohio,Wallis and Futuna,12.68655,-67.779737,Hotel exist.,excluded,Charge seem ask enter wife property.,Fm-7516,686e08165310467dcf1eeab1
Project Start,"42372 Daniel Village, South Brentville, Mauritius",42372,Daniel Village,South Brentville,80720,New York,Mauritius,56.8912685,-21.377855,Lot people lot.,included,Hold goal later bill consider learn next yourself business bring.,Vb-1520,686e08165310467dcf1eeab1
Those Total,"8471 Jones Haven, Tammyborough, Bolivia",8471,Jones Haven,Tammyborough,40839,Minnesota,Bolivia,6.669368,154.28881,Difficult trial practice population decide.,partially-included,Admit five career development.,QO-3706,686e08165310467dcf1eeab1
Interesting Seven,"1337 Morris Flat, New Brian, Belgium",1337,Morris Flat,New Brian,87329,South Carolina,Belgium,-6.8218055,-83.734625,Type manage home popular organization.,partially-included,No comments,Nn-8656,686e08165310467dcf1eeab1
Almost Maintain,"3669 Goodman Canyon, Stantonside, Bosnia and Herzegovina",3669,Goodman Canyon,Stantonside,53162,Colorado,Bosnia and Herzegovina,-39.799945,16.960207,Seek gas else knowledge sure upon.,included,Summer head.,xw-8923,686e08165310467dcf1eeab1
Morning Card,"333 Jake Dale, Matthewside, Moldova",333,Jake Dale,Matthewside,46878,South Carolina,Moldova,37.1089385,59.372328,Keep American skill us generation weight particular.,excluded,Add without name.,qk-6101,686e08165310467dcf1eeab1
Realize Whose,"0355 Cox Locks, Heatherchester, Ukraine",0355,Cox Locks,Heatherchester,86625,North Carolina,Ukraine,-64.806464,148.727472,Low note color station boy generation avoid woman.,included,No comments,Na-7201,686e08165310467dcf1eeab1
International Of,"4655 Brady Cove, West Henry, Belize",4655,Brady Cove,West Henry,41455,Kansas,Belize,-48.0344025,82.422598,Through especially total surface knowledge.,included,But direction ground range.,du-0921,686e08165310467dcf1eeab1
Southern Major,"74258 Erin Falls, Emilymouth, New Caledonia",74258,Erin Falls,Emilymouth,65707,Nebraska,New Caledonia,-50.9577175,-85.295568,Manager could tough approach affect reach future serious system.,included,No comments,uy-1967,686e08165310467dcf1eeab1
Second While,"593 Munoz Ranch, South Kim, Turkmenistan",593,Munoz Ranch,South Kim,34069,Alabama,Turkmenistan,19.2641405,-4.37245,Employee not yes remain tend.,included,No comments,bF-7575,686e08165310467dcf1eeab1
Common Reach,"764 Tammy Port, South Kyleland, Western Sahara",764,Tammy Port,South Kyleland,94156,Hawaii,Western Sahara,-44.1367385,95.803411,Affect generation late product development low.,included,No comments,GG-0660,686e08165310467dcf1eeab1
From Past,"0805 Morgan Manor, New Heatherland, Bosnia and Herzegovina",0805,Morgan Manor,New Heatherland,40551,Connecticut,Bosnia and Herzegovina,4.2427715,-80.783355,Ten decade fear record.,partially-included,No comments,gg-2329,686e08165310467dcf1eeab1
Magazine Outside,"302 Natalie Points, Lake Thomasshire, Haiti",302,Natalie Points,Lake Thomasshire,17222,New Hampshire,Haiti,25.6788415,29.008837,Mrs make.,included,Movie particular ten.,lR-3822,686e08165310467dcf1eeab1
Shoulder Save,"5883 Terri Expressway, Jonathanview, Reunion",5883,Terri Expressway,Jonathanview,58681,Missouri,Reunion,10.1677565,-136.32121,Exactly seat present person son more.,excluded,No comments,EZ-3228,686e08165310467dcf1eeab1
Future Upon,"3019 Mark Branch, Richardbury, Lithuania",3019,Mark Branch,Richardbury,89595,Florida,Lithuania,72.132171,-51.626073,Wish three head.,included,No comments,eM-8786,686e08165310467dcf1eeab1
Others Almost,"7617 Price Trace, New Stephanie, New Caledonia",7617,Price Trace,New Stephanie,36700,Alabama,New Caledonia,6.488289,33.910698,Why either group matter rule.,included,No comments,Pk-1646,686e08165310467dcf1eeab1
Painting Follow,"33645 Deborah Ranch, North Ryantown, Svalbard & Jan Mayen Islands",33645,Deborah Ranch,North Ryantown,40585,Wisconsin,Svalbard & Jan Mayen Islands,13.77329,-3.749599,Accept reflect stop pull test the road young.,excluded,No comments,Jp-1429,686e08165310467dcf1eeab1
Not Common,"26547 Jane Street, Lake Michellemouth, Samoa",26547,Jane Street,Lake Michellemouth,54705,Alaska,Samoa,-78.409334,74.590396,Arm next several town.,excluded,No comments,gn-5706,686e08165310467dcf1eeab1
Model Other,"49918 Holly Underpass, West Lisaport, Congo",49918,Holly Underpass,West Lisaport,35950,Wyoming,Congo,-20.3116315,173.515745,Door for let region.,excluded,Not walk fast bit recently.,NE-9206,686e08165310467dcf1eeab1
Serious Republican,"05471 Lane View, Richardside, Eritrea",05471,Lane View,Richardside,64863,New Mexico,Eritrea,-76.258446,151.041493,Financial process drug somebody travel.,partially-included,And face miss enough see stay.,PO-5576,686e08165310467dcf1eeab1
Develop Fall,"328 Gibson Cove, West Justinmouth, Kenya",328,Gibson Cove,West Justinmouth,97819,Nebraska,Kenya,85.1167545,108.874607,Year detail indicate.,included,Special moment spend personal a subject lose.,Gz-5041,686e08165310467dcf1eeab1
Charge Girl,"9342 Long Mission, Ballstad, Romania",9342,Long Mission,Ballstad,83704,Texas,Romania,76.0998795,63.897589,Across today less away describe interesting itself evidence entire.,excluded,No comments,uX-0155,686e08165310467dcf1eeab1
Quickly Office,"77733 Jimmy Trail, Port Andrewmouth, Eritrea",77733,Jimmy Trail,Port Andrewmouth,70799,California,Eritrea,83.2281535,165.993977,Town religious particular often.,partially-included,No comments,JW-6593,686e08165310467dcf1eeab1
Environmental Sing,"119 Roberts Ville, Taylorfurt, Mauritius",119,Roberts Ville,Taylorfurt,83365,Alaska,Mauritius,-79.065712,87.450363,Since wonder admit.,excluded,No comments,NG-7354,686e08165310467dcf1eeab1
Far History,"81526 Charles Viaduct, Bowmanbury, British Virgin Islands",81526,Charles Viaduct,Bowmanbury,33435,Montana,British Virgin Islands,31.6827895,76.52536,Coach sure successful month man.,partially-included,No comments,Fd-8300,686e08165310467dcf1eeab1
Black Yeah,"2725 Richard Dam, Lynnport, Guinea-Bissau",2725,Richard Dam,Lynnport,41073,Missouri,Guinea-Bissau,-27.884524,40.371438,Bit fight talk understand let what support million network ever.,included,No comments,MM-5332,686e08165310467dcf1eeab1
Paper More,"820 Acosta Falls, West Sherri, Georgia",820,Acosta Falls,West Sherri,38221,New Mexico,Georgia,-27.4583205,14.346394,We road money.,included,No comments,LK-8090,686e08165310467dcf1eeab1
Wide Threat,"162 Wallace Island, East Antoniomouth, Cook Islands",162,Wallace Island,East Antoniomouth,43783,Kentucky,Cook Islands,-6.337341,-104.15087,Image ball dream rock control.,excluded,No comments,cS-2216,686e08165310467dcf1eeab1
Structure View,"67940 Miller Squares, North Dean, South Georgia and the South Sandwich Islands",67940,Miller Squares,North Dean,87506,North Carolina,South Georgia and the South Sandwich Islands,-79.8129405,-42.788245,Top sea.,partially-included,Threat change agreement.,Fb-9199,686e08165310467dcf1eeab1
Red Wide,"39205 Catherine Shore, West Wyatt, Kyrgyz Republic",39205,Catherine Shore,West Wyatt,15283,New York,Kyrgyz Republic,83.1072885,115.719096,Thank or water ability.,included,Make within off.,OM-9877,686e08165310467dcf1eeab1
World Night,"42362 Lindsey Centers, Gordonshire, Norfolk Island",42362,Lindsey Centers,Gordonshire,82364,Kansas,Norfolk Island,-55.504602,-177.5088,Research defense.,included,No comments,XU-8556,686e08165310467dcf1eeab1
Already Card,"395 Arnold Summit, North Johnshire, Seychelles",395,Arnold Summit,North Johnshire,16825,Idaho,Seychelles,34.5648955,2.870706,Voice interview just send under maybe.,partially-included,No comments,Oz-2996,686e08165310467dcf1eeab1
Major Everything,"1441 Kristin Viaduct, South Kaitlyn, Zimbabwe",1441,Kristin Viaduct,South Kaitlyn,74223,Michigan,Zimbabwe,-20.4525595,146.068334,Edge room job challenge road.,excluded,Feeling notice shake.,kA-9483,686e08165310467dcf1eeab1
Follow Report,"2476 Michelle Crossroad, East Heatherview, Palau",2476,Michelle Crossroad,East Heatherview,61049,Virginia,Palau,58.863991,-33.075174,Manager like camera put.,included,No comments,Bn-1056,686e08165310467dcf1eeab1
Activity Across,"5166 Ross Mountain, West Jamesside, El Salvador",5166,Ross Mountain,West Jamesside,22764,Kentucky,El Salvador,47.841858,38.000826,Best positive concern yeah.,included,No comments,yg-9587,686e08165310467dcf1eeab1
Still New,"562 Gillespie Route, West Emilybury, Burkina Faso",562,Gillespie Route,West Emilybury,10126,Utah,Burkina Faso,31.6698655,-159.875028,Doctor identify study successful when watch shoulder class society.,partially-included,No comments,ec-4243,686e08165310467dcf1eeab1
Magazine Rise,"42327 Crystal Points, Brandonland, Poland",42327,Crystal Points,Brandonland,97228,South Dakota,Poland,27.7644305,-121.909919,Well expect part economy present full.,excluded,No comments,Kf-2815,686e08165310467dcf1eeab1
Main Bit,"2156 Cross Island, Olsonborough, Sudan",2156,Cross Island,Olsonborough,60611,Florida,Sudan,-20.8357285,157.534668,Any despite ok must Mr.,excluded,No comments,LK-9582,686e08165310467dcf1eeab1
Tax Study,"1445 Sarah Squares, East Madelinefurt, Czech Republic",1445,Sarah Squares,East Madelinefurt,27057,Virginia,Czech Republic,-38.01211,-91.682775,International water.,excluded,No comments,HK-2698,686e08165310467dcf1eeab1
Pretty Price,"53060 Cordova Roads, Graystad, United States Virgin Islands",53060,Cordova Roads,Graystad,37095,Massachusetts,United States Virgin Islands,-29.771781,-48.487145,Author per tonight save yet Democrat turn notice.,included,No comments,Ed-1301,686e08165310467dcf1eeab1
Should Environment,"89324 Natalie Ramp, Sarahchester, Guernsey",89324,Natalie Ramp,Sarahchester,91695,Nevada,Guernsey,-60.480836,64.190809,Just laugh prepare kind cultural member chair.,partially-included,No comments,mV-5853,686e08165310467dcf1eeab1
State Parent,"664 David Roads, Danielland, Cuba",664,David Roads,Danielland,39878,Louisiana,Cuba,-78.0020215,-59.240026,Phone hot quality day step.,included,Enough his both feel check room.,di-0711,686e08165310467dcf1eeab1
Rich Popular,"8059 Kelly Tunnel, Lake Lori, Papua New Guinea",8059,Kelly Tunnel,Lake Lori,86251,Pennsylvania,Papua New Guinea,3.114445,89.53186,About voice glass behavior physical think.,excluded,No comments,qE-3617,686e08165310467dcf1eeab1
Represent Two,"54205 Rodriguez Ways, Melissaside, Macao",54205,Rodriguez Ways,Melissaside,99111,Nevada,Macao,-61.5654705,11.043421,Home unit the customer fact between to agent.,excluded,No comments,FU-7539,686e08165310467dcf1eeab1
Section Pretty,"578 Crystal Forge, North Kellyville, Suriname",578,Crystal Forge,North Kellyville,88436,Maine,Suriname,-11.5758815,21.819395,Memory again offer.,included,No comments,vW-8722,686e08165310467dcf1eeab1
Exist Message,"643 Benjamin Mountains, New Amy, Cook Islands",643,Benjamin Mountains,New Amy,57058,Connecticut,Cook Islands,-21.5143355,51.318112,Common peace full energy specific exactly.,included,No comments,vb-7602,686e08165310467dcf1eeab1
Citizen Trial,"127 Wendy Trace, Pattersonport, Mongolia",127,Wendy Trace,Pattersonport,37175,New Jersey,Mongolia,27.495421,53.356864,Despite least world catch major five cultural couple.,included,No comments,Nt-1346,686e08165310467dcf1eeab1
Growth Allow,"297 Taylor Land, East Caitlinmouth, Heard Island and McDonald Islands",297,Taylor Land,East Caitlinmouth,21206,Maryland,Heard Island and McDonald Islands,-48.627801,-132.041087,Able authority south kitchen myself business despite sense believe.,included,Hot everybody stand determine.,FB-0834,686e08165310467dcf1eeab1
Part I,"68981 Mosley Course, Benitezborough, Mali",68981,Mosley Course,Benitezborough,78989,Illinois,Mali,48.119041,-19.833242,Work respond prepare.,excluded,No comments,Rn-8922,686e08165310467dcf1eeab1
Himself Exist,"71801 Ryan Trafficway, New Sharon, Martinique",71801,Ryan Trafficway,New Sharon,09613,Montana,Martinique,-5.1768425,130.762897,Throw loss.,included,No comments,gf-8621,686e08165310467dcf1eeab1
Board From,"19377 Alicia Cape, Haleport, Nepal",19377,Alicia Cape,Haleport,10517,Illinois,Nepal,-2.3682285,124.658782,Two six seek attack about.,excluded,Animal area account.,aJ-7520,686e08165310467dcf1eeab1
Eye Structure,"22083 Chad Loop, South Sarahton, Saint Helena",22083,Chad Loop,South Sarahton,09864,Colorado,Saint Helena,-79.1253715,122.685898,Article my watch set their partner such class about.,excluded,Wall far type leg news body.,ns-8213,686e08165310467dcf1eeab1
Much Heavy,"941 Justin Wall, Sanchezhaven, Vietnam",941,Justin Wall,Sanchezhaven,85282,California,Vietnam,48.783587,-9.534166,Author customer drop sign industry.,included,No comments,Qh-3559,686e08165310467dcf1eeab1
Civil Sell,"6051 Jamie Turnpike, Nashshire, Isle of Man",6051,Jamie Turnpike,Nashshire,85732,Nevada,Isle of Man,-50.007379,128.983387,Create value station almost stay section wife.,excluded,No comments,CW-2556,686e08165310467dcf1eeab1
Follow Major,"291 Christopher Crossroad, Fischerburgh, Guernsey",291,Christopher Crossroad,Fischerburgh,89678,Massachusetts,Guernsey,-6.284047,4.011572,Place school question although authority.,included,No comments,xK-7227,686e08165310467dcf1eeab1
Collection Arm,"3813 Kenneth Glens, Dominiqueview, Togo",3813,Kenneth Glens,Dominiqueview,15935,Vermont,Togo,43.541987,96.770663,Old guy watch.,excluded,Hear development vote media writer.,uo-7026,686e08165310467dcf1eeab1
That Every,"014 Melanie Avenue, Andreborough, Seychelles",014,Melanie Avenue,Andreborough,73195,North Dakota,Seychelles,62.5567515,156.447466,Say degree yeah easy fund key care necessary.,excluded,No comments,yc-9421,686e08165310467dcf1eeab1
Sound Sometimes,"87090 Wilson Pines, East Kennethview, Mali",87090,Wilson Pines,East Kennethview,85182,Delaware,Mali,-71.8172435,151.296218,We four catch somebody exactly relate past them.,included,Real friend democratic.,gB-8373,686e08165310467dcf1eeab1
According Election,"947 Adam Common, North Annland, Zambia",947,Adam Common,North Annland,19342,Georgia,Zambia,-10.7845195,-91.297758,Poor skin both market impact significant.,included,Until quality.,Rf-2542,686e08165310467dcf1eeab1
Approach Hold,"64744 Jessica Estates, Nguyenborough, Trinidad and Tobago",64744,Jessica Estates,Nguyenborough,20953,Minnesota,Trinidad and Tobago,57.459268,-171.27178,Interesting as shake.,partially-included,No comments,BS-8346,686e08165310467dcf1eeab1
Activity Election,"88542 Jones Parkways, North Matthewville, Gibraltar",88542,Jones Parkways,North Matthewville,63706,Arkansas,Gibraltar,-78.1208455,161.573199,Individual service environment heavy cause sometimes exactly.,partially-included,No comments,EY-7033,686e08165310467dcf1eeab1
Employee There,"60855 Arellano Hills, South Amandabury, Bolivia",60855,Arellano Hills,South Amandabury,99656,Hawaii,Bolivia,-5.075644,-137.350377,Artist enough hotel market region.,excluded,No comments,xM-3615,686e08165310467dcf1eeab1
Particularly Teacher,"500 Charlotte Centers, Lake Thomasstad, Netherlands",500,Charlotte Centers,Lake Thomasstad,31962,Indiana,Netherlands,-11.9160005,157.851634,Type politics scene compare blood.,excluded,Article consider opportunity institution.,iR-1613,686e08165310467dcf1eeab1
Hundred Better,"07182 Atkinson Fields, Lake Duane, Egypt",07182,Atkinson Fields,Lake Duane,20846,Indiana,Egypt,-79.245564,-157.434706,Represent wait represent head.,partially-included,No comments,rH-4127,686e08165310467dcf1eeab1
Pm Entire,"1371 Howard Corners, East Andrewborough, Libyan Arab Jamahiriya",1371,Howard Corners,East Andrewborough,65722,North Carolina,Libyan Arab Jamahiriya,-31.6926745,46.465766,Least cell we treatment their debate religious.,included,No comments,Yk-2185,686e08165310467dcf1eeab1
Clear House,"90215 Wilson Wells, East Haley, Togo",90215,Wilson Wells,East Haley,55657,Connecticut,Togo,72.309162,-51.318505,Them stop.,excluded,No comments,dn-9223,686e08165310467dcf1eeab1
Buy Describe,"663 Sanchez Port, Fishershire, Holy See (Vatican City State)",663,Sanchez Port,Fishershire,08650,Tennessee,Holy See (Vatican City State),-55.672598,-2.387263,Summer war turn raise draw draw of wonder white.,excluded,Plant again suddenly.,ma-9373,686e08165310467dcf1eeab1
Shoulder Career,"948 Stephanie Rapid, Port Wayne, Cameroon",948,Stephanie Rapid,Port Wayne,99319,Arkansas,Cameroon,78.566616,-83.060255,Night guy program lay treat game.,included,No comments,sm-2614,686e08165310467dcf1eeab1
Over Difference,"41295 Kimberly Gateway, South Glenn, Haiti",41295,Kimberly Gateway,South Glenn,03359,Nebraska,Haiti,-53.884693,-165.780807,Stock its suffer growth ok.,partially-included,No comments,Mq-6272,686e08165310467dcf1eeab1
Southern Spring,"4828 Garcia Falls, East Krista, Switzerland",4828,Garcia Falls,East Krista,35643,Pennsylvania,Switzerland,-34.3072275,3.178463,Doctor drop rate cost inside song on great.,included,No comments,Pw-1859,686e08165310467dcf1eeab1
Half Conference,"67812 George Creek, Davisstad, Antarctica (the territory South of 60 deg S)",67812,George Creek,Davisstad,24821,South Carolina,Antarctica (the territory South of 60 deg S),-75.6601675,-27.944629,News the management.,partially-included,While wall low there decide.,Eu-3861,686e08165310467dcf1eeab1
Benefit Box,"307 Megan Causeway, Haileyhaven, Moldova",307,Megan Causeway,Haileyhaven,35735,Hawaii,Moldova,25.1295585,-90.59792,Consumer someone similar middle easy.,included,No comments,Yc-7411,686e08165310467dcf1eeab1
Eat Forward,"93952 Nicholas Throughway, West Darryl, Italy",93952,Nicholas Throughway,West Darryl,77595,Illinois,Italy,74.4480665,31.341715,Physical reach democratic.,included,No comments,AM-3028,686e08165310467dcf1eeab1
Area Part,"19318 Baker Isle, Alvareztown, Reunion",19318,Baker Isle,Alvareztown,12585,Texas,Reunion,-63.214195,23.990241,Involve them.,excluded,No comments,xT-2055,686e08165310467dcf1eeab1
