locationRef,addressInMap,addressBuilding,addressStreet,addressCity,addressPostCode,addressStateProvince,addressCountry,lat,lng,descriptionOfActivities,ghgAssessmentInclusion,comment,subCode,tenantId
Which Office,"1918 Brooks Coves, New Bradley, Korea",1918,Brooks Coves,New Bradley,25867,Minnesota,Korea,82.4926915,-170.14596,Up door miss I easy great until.,partially-included,No comments,NQ-0164,686e08165310467dcf1eeab1
Yeah New,"677 Jones Gardens, Lake Andrea, Guadeloupe",677,Jones Gardens,Lake Andrea,81406,Alabama,Guadeloupe,-38.0284975,153.736634,Three hard actually him painting.,excluded,No comments,rB-5697,686e08165310467dcf1eeab1
Court Science,"65306 Hoffman Underpass, East Bryanbury, Russian Federation",65306,Hoffman Underpass,East Bryanbury,97988,Idaho,Russian Federation,-50.323087,-127.579219,Season human major who.,partially-included,Fear between relationship.,nS-6925,686e08165310467dcf1eeab1
Hear Return,"798 Michelle Mountains, Higginsberg, Guyana",798,Michelle Mountains,Higginsberg,56389,West Virginia,Guyana,32.258087,-177.077181,Whether world.,partially-included,You charge.,FM-3080,686e08165310467dcf1eeab1
Hour Require,"34297 Thompson Street, Linton, Saudi Arabia",34297,Thompson Street,Linton,25191,Ohio,Saudi Arabia,74.25644,-176.774549,Candidate any two.,excluded,Campaign conference sense exactly.,ld-5161,686e08165310467dcf1eeab1
Discuss Need,"41486 Jennifer Burg, Underwoodville, Belarus",41486,Jennifer Burg,Underwoodville,06700,Washington,Belarus,-27.7207165,-108.809313,Happen speak.,included,No comments,cE-7178,686e08165310467dcf1eeab1
Generation Professor,"04696 Ortega Land, Greenfurt, Uruguay",04696,Ortega Land,Greenfurt,87584,Washington,Uruguay,-67.6882515,178.146284,Away level away condition condition look answer.,excluded,Year happen sure political side force.,ZL-1652,686e08165310467dcf1eeab1
Very Buy,"8864 Lucero Throughway, Darrenfurt, Turkey",8864,Lucero Throughway,Darrenfurt,13887,Delaware,Turkey,67.3278095,-12.247306,Tv it.,included,No comments,tM-0588,686e08165310467dcf1eeab1
Voice Wind,"08878 Ann Island, South Stephaniefurt, Mexico",08878,Ann Island,South Stephaniefurt,35851,Arizona,Mexico,89.726851,-171.014466,Show bill child too great never leader energy network.,excluded,Raise close speech measure great.,Cr-8598,686e08165310467dcf1eeab1
Position After,"838 Hampton Vista, Michelleview, Liechtenstein",838,Hampton Vista,Michelleview,49230,New Jersey,Liechtenstein,-56.3118375,156.564541,Water media development rather certain.,included,No comments,GB-6883,686e08165310467dcf1eeab1
Look Owner,"615 Mcmahon Plaza, Sampsonville, South Georgia and the South Sandwich Islands",615,Mcmahon Plaza,Sampsonville,45065,Indiana,South Georgia and the South Sandwich Islands,20.472381,-103.192942,Culture whose loss fly.,included,No comments,rW-0857,686e08165310467dcf1eeab1
Administration Nothing,"201 Villarreal Roads, Jenniferview, Spain",201,Villarreal Roads,Jenniferview,99190,Kentucky,Spain,21.8125865,74.92363,Tax laugh focus suggest stock decision if.,included,Not prevent hold doctor nation.,cB-7648,686e08165310467dcf1eeab1
Position Understand,"17871 Paul Run, North Robertbury, Liechtenstein",17871,Paul Run,North Robertbury,12329,Alaska,Liechtenstein,-64.456777,-18.083098,Create heart.,excluded,No comments,Ta-8442,686e08165310467dcf1eeab1
Particular Not,"9163 Laura Inlet, Gamblechester, Slovenia",9163,Laura Inlet,Gamblechester,59465,Louisiana,Slovenia,65.1243535,-173.790663,Those president star same organization note ok.,excluded,Medical receive decide citizen somebody radio quite military themselves.,GO-5279,686e08165310467dcf1eeab1
Us Other,"21146 David Corner, North Tyler, Lesotho",21146,David Corner,North Tyler,29652,Rhode Island,Lesotho,6.79907,-102.546432,Son identify task form fund.,included,Better see if whole walk.,Vo-3149,686e08165310467dcf1eeab1
Side Travel,"29630 Brianna Junctions, Port Jamestown, Malawi",29630,Brianna Junctions,Port Jamestown,19863,South Carolina,Malawi,-62.8629125,26.742497,Sort something admit.,included,No comments,Qx-6794,686e08165310467dcf1eeab1
Number Safe,"0562 Ross Plaza, Lake Michael, Western Sahara",0562,Ross Plaza,Lake Michael,41841,Texas,Western Sahara,19.660419,33.14764,Chance morning yet.,included,No comments,la-3133,686e08165310467dcf1eeab1
Street Shake,"32404 Jennifer Union, Johnsonfurt, Namibia",32404,Jennifer Union,Johnsonfurt,96089,Connecticut,Namibia,45.714435,142.848001,Enjoy data explain apply performance hair.,included,No comments,LR-2386,686e08165310467dcf1eeab1
Radio Quality,"0655 Jessica Cove, Roberthaven, Gibraltar",0655,Jessica Cove,Roberthaven,86258,Montana,Gibraltar,-60.3920585,-78.130484,Keep.,excluded,No comments,Rh-9330,686e08165310467dcf1eeab1
Movement Store,"14164 Keith Fort, Wushire, Tajikistan",14164,Keith Fort,Wushire,80031,Delaware,Tajikistan,77.9654975,-28.307264,Direction whose early half range parent.,excluded,No comments,vD-3553,686e08165310467dcf1eeab1
Mouth Pressure,"2684 Kristine Lodge, Matthewport, Ghana",2684,Kristine Lodge,Matthewport,43704,Indiana,Ghana,82.9810425,-9.975948,Require either anyone she.,included,No comments,Bt-7379,686e08165310467dcf1eeab1
American Include,"9429 Thomas Bypass, East Rachelmouth, Palestinian Territory",9429,Thomas Bypass,East Rachelmouth,91609,Tennessee,Palestinian Territory,71.066705,-30.221827,Break market.,excluded,No comments,lv-8379,686e08165310467dcf1eeab1
Believe Industry,"0266 Felicia Expressway, Port Joseport, Hong Kong",0266,Felicia Expressway,Port Joseport,09735,Michigan,Hong Kong,-55.97106,-70.085822,Letter too officer more report cultural country add.,partially-included,Wish her majority foot design eye party.,DG-2116,686e08165310467dcf1eeab1
Tax It,"456 Garrett Rest, Prestonton, Cook Islands",456,Garrett Rest,Prestonton,61674,Kentucky,Cook Islands,-60.724127,38.49643,Book plant parent make actually along.,partially-included,No comments,ff-3520,686e08165310467dcf1eeab1
Class Art,"37331 Lauren Canyon, Port Carolburgh, San Marino",37331,Lauren Canyon,Port Carolburgh,30404,Oklahoma,San Marino,10.7814075,-106.70961,Information sell many own sense.,included,No comments,sJ-7486,686e08165310467dcf1eeab1
That Issue,"61498 Conway Rest, North Gregory, Mauritania",61498,Conway Rest,North Gregory,27011,New York,Mauritania,-8.9937115,-136.775705,Detail discover sort American everything nature my.,partially-included,No comments,gq-2184,686e08165310467dcf1eeab1
Color Look,"642 Potter Track, Castilloburgh, Egypt",642,Potter Track,Castilloburgh,15448,Pennsylvania,Egypt,16.5012135,132.41279,Method throw bill someone economic.,excluded,No comments,lJ-3081,686e08165310467dcf1eeab1
Five Rise,"3430 Armstrong Keys, Danielsbury, New Zealand",3430,Armstrong Keys,Danielsbury,92970,Massachusetts,New Zealand,-36.8892255,-40.47592,Market follow ever make control their.,included,No comments,SQ-7316,686e08165310467dcf1eeab1
Seat Half,"6588 Caitlin Union, New Sherryton, Taiwan",6588,Caitlin Union,New Sherryton,00922,Montana,Taiwan,1.3767975,12.571815,Television value PM could quite south.,included,No comments,Br-0620,686e08165310467dcf1eeab1
Listen I,"5843 Lauren Fords, Port John, Haiti",5843,Lauren Fords,Port John,44618,Louisiana,Haiti,19.5146885,95.260722,Until drug never rather billion.,excluded,No comments,As-1761,686e08165310467dcf1eeab1
Doctor Should,"31066 Daryl Prairie, South Alexanderfurt, Cook Islands",31066,Daryl Prairie,South Alexanderfurt,53030,Michigan,Cook Islands,23.824069,18.644974,Listen attorney claim eight much ability.,partially-included,No comments,Tc-9646,686e08165310467dcf1eeab1
Big Land,"7510 Carol Spring, South Spencerview, United Kingdom",7510,Carol Spring,South Spencerview,18987,West Virginia,United Kingdom,51.78967,1.15597,Class week require care ready clear camera.,included,No comments,Fd-5186,686e08165310467dcf1eeab1
Human Manager,"528 Mcdonald Flat, East Paul, Panama",528,Mcdonald Flat,East Paul,82029,Nevada,Panama,-6.1878635,18.808226,Bill control full budget again church why.,excluded,Dark consider run society establish brother size notice soldier your loss.,TD-7002,686e08165310467dcf1eeab1
Tonight No,"92358 Jensen Via, North Davidview, Reunion",92358,Jensen Via,North Davidview,77623,New Hampshire,Reunion,-48.9534055,-37.202157,Work read begin article them.,excluded,No comments,oY-3990,686e08165310467dcf1eeab1
Authority Foreign,"11412 David Curve, Melissaton, Saint Helena",11412,David Curve,Melissaton,37098,Illinois,Saint Helena,-57.3250975,-122.752317,What bit.,partially-included,No comments,TB-9596,686e08165310467dcf1eeab1
True Why,"37019 Mccarty Route, Angelaview, Argentina",37019,Mccarty Route,Angelaview,72386,New York,Argentina,88.8211445,-131.156361,Field line.,excluded,No comments,pO-5707,686e08165310467dcf1eeab1
Example Although,"33864 Kristen Fords, Pottsside, Cameroon",33864,Kristen Fords,Pottsside,71124,Massachusetts,Cameroon,26.409962,78.425137,Until majority majority represent home forget against.,partially-included,No comments,Sh-3428,686e08165310467dcf1eeab1
Together Discover,"418 Farmer Brook, Port April, Aruba",418,Farmer Brook,Port April,15345,Ohio,Aruba,-12.9298465,-177.227369,Baby page.,excluded,Beyond nor indicate myself close.,yO-2905,686e08165310467dcf1eeab1
From Drop,"87585 Gilbert Centers, West Bradley, Saint Helena",87585,Gilbert Centers,West Bradley,86272,Minnesota,Saint Helena,86.5052655,148.765112,And late moment different.,included,Exist culture care personal.,hH-9806,686e08165310467dcf1eeab1
Pm Time,"487 Anthony Prairie, Mcclureview, Andorra",487,Anthony Prairie,Mcclureview,52268,Maine,Andorra,19.9783455,-42.489537,Suggest fund center set.,partially-included,No comments,SW-3639,686e08165310467dcf1eeab1
Fly Support,"12753 James Stravenue, South Michelle, Ecuador",12753,James Stravenue,South Michelle,81226,Washington,Ecuador,51.1650075,52.393762,Girl form ready table.,excluded,Front expect house.,Xt-5725,686e08165310467dcf1eeab1
Watch Wish,"5850 Matthew Land, Cooperton, Uzbekistan",5850,Matthew Land,Cooperton,63378,South Carolina,Uzbekistan,-46.2374795,102.375191,Marriage her born admit record.,excluded,No comments,Ib-8585,686e08165310467dcf1eeab1
Rise Although,"1264 Rodriguez Heights, Danielborough, Ghana",1264,Rodriguez Heights,Danielborough,46283,Michigan,Ghana,-71.1857365,-14.026378,She business institution or.,partially-included,No comments,UU-3760,686e08165310467dcf1eeab1
Citizen Whether,"672 Martinez Radial, West Loriville, Guinea",672,Martinez Radial,West Loriville,37103,Nevada,Guinea,-63.522951,-134.901367,Never training star town camera.,excluded,State forward heavy natural.,sc-0089,686e08165310467dcf1eeab1
Theory Body,"8771 Rivera Cape, Josephberg, Latvia",8771,Rivera Cape,Josephberg,03214,Missouri,Latvia,-48.569208,-110.485037,Pretty central sure nearly month to half dog prepare.,partially-included,No comments,Rr-9805,686e08165310467dcf1eeab1
Young Third,"48656 Marshall Passage, West Nathaniel, Aruba",48656,Marshall Passage,West Nathaniel,13046,Arizona,Aruba,-24.8372915,10.916792,Part able some.,included,Program the question.,Ya-0077,686e08165310467dcf1eeab1
Agency Why,"727 Keith Walk, New Travischester, Venezuela",727,Keith Walk,New Travischester,61066,Delaware,Venezuela,87.323958,158.433093,Not your may.,included,No comments,gZ-2128,686e08165310467dcf1eeab1
Idea Machine,"59109 Rivas Squares, Port Jennifer, Angola",59109,Rivas Squares,Port Jennifer,94904,Delaware,Angola,-62.515817,-32.373692,Trial create their fine.,excluded,Responsibility someone air question left.,Ud-5593,686e08165310467dcf1eeab1
Name Happen,"90186 Peter Wall, Jenniferview, Northern Mariana Islands",90186,Peter Wall,Jenniferview,13866,Maryland,Northern Mariana Islands,-34.6358445,-91.169385,Light watch me.,excluded,No comments,oz-7395,686e08165310467dcf1eeab1
Final Subject,"0231 Zuniga Grove, Ibarraton, South Africa",0231,Zuniga Grove,Ibarraton,93164,California,South Africa,35.180755,-59.056362,Think form.,included,No comments,XB-5492,686e08165310467dcf1eeab1
Artist Probably,"6943 Turner Spring, Hernandezfurt, Bolivia",6943,Turner Spring,Hernandezfurt,37613,Nevada,Bolivia,-8.4396695,-108.755694,Name quickly she say.,excluded,No comments,uB-2422,686e08165310467dcf1eeab1
Blood Produce,"92029 Elizabeth Stream, Lynchville, Gabon",92029,Elizabeth Stream,Lynchville,53952,Connecticut,Gabon,22.9225915,-27.269847,Thank concern list table oil cover.,excluded,No comments,vf-4009,686e08165310467dcf1eeab1
Enjoy Appear,"29704 Hannah Route, Carloston, Burundi",29704,Hannah Route,Carloston,38459,Alaska,Burundi,-83.97497,-71.161201,Certain Democrat would your raise.,excluded,Central throughout scientist miss hope my.,qI-1601,686e08165310467dcf1eeab1
Human Number,"740 Dustin Canyon, Port Scott, Micronesia",740,Dustin Canyon,Port Scott,33793,Louisiana,Micronesia,-46.368124,-131.042844,Main participant people per sport raise hit.,included,No comments,gA-7193,686e08165310467dcf1eeab1
Interest Beautiful,"84034 Gutierrez Club, North Vanessa, Bulgaria",84034,Gutierrez Club,North Vanessa,39659,Kansas,Bulgaria,-75.246195,31.739529,Friend scene national executive there.,included,No comments,jn-3059,686e08165310467dcf1eeab1
Follow With,"827 Gregory Trace, East Mariafurt, Burkina Faso",827,Gregory Trace,East Mariafurt,23125,Alabama,Burkina Faso,-10.090521,-139.945914,Group stop history the eye.,partially-included,No comments,IQ-5097,686e08165310467dcf1eeab1
Surface Too,"1286 Martinez Causeway, Duncanbury, Palestinian Territory",1286,Martinez Causeway,Duncanbury,41036,Illinois,Palestinian Territory,-51.398505,3.010717,Provide it performance hot today.,included,No comments,HQ-4120,686e08165310467dcf1eeab1
Go Story,"368 Patel Tunnel, Lake Austin, Tonga",368,Patel Tunnel,Lake Austin,03275,Washington,Tonga,49.2446785,2.48087,Involve law training point avoid.,included,No comments,rk-4802,686e08165310467dcf1eeab1
Process Policy,"4752 Lee Squares, East Cynthiamouth, Hong Kong",4752,Lee Squares,East Cynthiamouth,66465,North Dakota,Hong Kong,58.4602915,160.531618,Design something.,excluded,No comments,rD-8120,686e08165310467dcf1eeab1
Pm Shoulder,"30137 Rodriguez View, Port Emilyfurt, Belgium",30137,Rodriguez View,Port Emilyfurt,75857,Arizona,Belgium,-54.3012825,-142.413879,Move simply.,included,Person science dog off send.,Hn-0866,686e08165310467dcf1eeab1
Bill Production,"904 Ramirez Motorway, South Jameschester, Sudan",904,Ramirez Motorway,South Jameschester,73220,Arizona,Sudan,-50.9104825,9.230297,Seem can firm plant gas.,included,No comments,Qg-5426,686e08165310467dcf1eeab1
Type Example,"12326 Danielle Via, Port Brandytown, Rwanda",12326,Danielle Via,Port Brandytown,27364,Minnesota,Rwanda,-71.845116,-157.955469,Back it enjoy recognize tell ask.,partially-included,Place the point air range market whole.,vY-3765,686e08165310467dcf1eeab1
Position House,"629 Rickey Light, North Christina, Switzerland",629,Rickey Light,North Christina,26753,Pennsylvania,Switzerland,-8.108841,-130.350233,Public raise feeling.,partially-included,No comments,nx-4583,686e08165310467dcf1eeab1
Himself Knowledge,"80661 Reginald Track, Kennethhaven, Guam",80661,Reginald Track,Kennethhaven,69748,Wyoming,Guam,61.8722055,6.316081,However hot wonder.,included,No comments,ak-3885,686e08165310467dcf1eeab1
Factor Read,"594 Denise Creek, East Morgan, Haiti",594,Denise Creek,East Morgan,84832,California,Haiti,50.195261,174.496567,List drive western point subject.,included,No comments,Jz-2515,686e08165310467dcf1eeab1
Officer See,"47883 Mark Extension, East Christopher, Chile",47883,Mark Extension,East Christopher,33166,West Virginia,Chile,-56.2458665,77.474346,Pull entire.,included,No comments,MN-9979,686e08165310467dcf1eeab1
Expect Only,"093 Lisa Fort, Jacobsborough, Hong Kong",093,Lisa Fort,Jacobsborough,66287,Ohio,Hong Kong,-55.7682815,-15.833073,Congress help middle exactly.,partially-included,No comments,Gx-8517,686e08165310467dcf1eeab1
Week Without,"7535 David Radial, South Jermainestad, Paraguay",7535,David Radial,South Jermainestad,04169,Maine,Paraguay,71.603603,-29.222288,Rate beyond visit third.,excluded,No comments,fC-6672,686e08165310467dcf1eeab1
Leader Let,"499 Miller Lock, Jameshaven, Bolivia",499,Miller Lock,Jameshaven,78860,Oklahoma,Bolivia,-39.684258,32.417671,Dream tonight from song dream forget.,included,No comments,HY-7799,686e08165310467dcf1eeab1
Instead Society,"04952 Reid Islands, North Angelahaven, Saint Barthelemy",04952,Reid Islands,North Angelahaven,26668,Kentucky,Saint Barthelemy,69.7773565,-60.339425,Bed central sort television my still.,partially-included,Recent direction fund skin.,fd-2368,686e08165310467dcf1eeab1
Partner Store,"74769 Amanda Plain, Port Shawnburgh, French Guiana",74769,Amanda Plain,Port Shawnburgh,09527,North Carolina,French Guiana,62.595846,-5.533501,Nature represent field energy family fight ever little.,included,In deep many your.,cp-3207,686e08165310467dcf1eeab1
Economy East,"5437 Alexandria Wall, Brittanychester, Benin",5437,Alexandria Wall,Brittanychester,05667,Oregon,Benin,-66.485468,-135.461053,Suffer defense admit enter provide cause sort capital but.,excluded,No comments,sB-4557,686e08165310467dcf1eeab1
Would Mission,"6301 Jose Place, Richardsonburgh, Seychelles",6301,Jose Place,Richardsonburgh,52512,Illinois,Seychelles,33.982622,-174.348457,Next couple base total full power admit.,partially-included,No comments,Zn-9480,686e08165310467dcf1eeab1
Candidate Guy,"1720 Tonya Crest, Port Shelleyview, Lithuania",1720,Tonya Crest,Port Shelleyview,04154,Wisconsin,Lithuania,-74.833238,73.457491,Throughout hair soon.,excluded,No comments,fr-5249,686e08165310467dcf1eeab1
Campaign Whom,"58293 Aguilar Lodge, Wintersview, Sweden",58293,Aguilar Lodge,Wintersview,10048,North Dakota,Sweden,-63.1957405,65.644173,Price box manage bring doctor edge figure while.,excluded,No comments,kq-1130,686e08165310467dcf1eeab1
Maintain Indeed,"73320 Watson Harbor, Lake Kelly, Georgia",73320,Watson Harbor,Lake Kelly,63647,Alabama,Georgia,58.0681165,20.96484,Pay certain fall plan.,excluded,Somebody step instead administration.,fb-5847,686e08165310467dcf1eeab1
Talk Pretty,"0500 Wilcox Motorway, North Tamara, Lesotho",0500,Wilcox Motorway,North Tamara,61018,Maryland,Lesotho,-20.2341665,-147.917668,Method involve service source appear over.,partially-included,No comments,QD-8064,686e08165310467dcf1eeab1
Among Wish,"5878 Rubio Haven, Berryshire, Macao",5878,Rubio Haven,Berryshire,37864,North Carolina,Macao,10.5242845,-117.814206,Since prevent unit board word almost community north.,partially-included,Challenge card decide hotel deep level pay.,iv-5353,686e08165310467dcf1eeab1
Officer Sit,"19137 Hale Gardens, Riveraport, Iraq",19137,Hale Gardens,Riveraport,34145,Connecticut,Iraq,-5.541965,-158.998541,Woman last you better lead statement.,partially-included,No comments,Mz-8223,686e08165310467dcf1eeab1
Protect Director,"712 Daniel Cliff, Wallsfurt, Czech Republic",712,Daniel Cliff,Wallsfurt,05634,Idaho,Czech Republic,14.2452535,-170.123673,Change identify number director such deep.,excluded,Prevent begin important nature trouble.,MT-3437,686e08165310467dcf1eeab1
Drug Now,"4382 Brittney Landing, Johnshire, United Kingdom",4382,Brittney Landing,Johnshire,64829,Hawaii,United Kingdom,53.69786,-2.68758,Can choice however require water item assume.,partially-included,No comments,Hu-6960,686e08165310467dcf1eeab1
Enjoy Nor,"255 Jacob Stravenue, Alexandermouth, Gabon",255,Jacob Stravenue,Alexandermouth,33339,Georgia,Gabon,42.9094085,-151.31899,Reach computer own safe weight people least.,excluded,No comments,Ce-0163,686e08165310467dcf1eeab1
Program Someone,"246 Lewis Avenue, New Michael, Bulgaria",246,Lewis Avenue,New Michael,61387,Texas,Bulgaria,85.1141195,-55.437382,Add fact.,included,No comments,wz-8144,686e08165310467dcf1eeab1
Me Table,"5104 Miranda Ramp, Parkerville, Cambodia",5104,Miranda Ramp,Parkerville,90654,Indiana,Cambodia,-25.471365,157.399158,Century hold brother hope another statement sell.,partially-included,No comments,MF-4970,686e08165310467dcf1eeab1
State Together,"28954 William Squares, Carrfort, Cameroon",28954,William Squares,Carrfort,57613,New Mexico,Cameroon,32.0206385,143.273693,If half husband.,included,No comments,Kb-2799,686e08165310467dcf1eeab1
Miss Way,"9483 Robinson Coves, Nicholasshire, Luxembourg",9483,Robinson Coves,Nicholasshire,82462,Tennessee,Luxembourg,73.2909545,91.399876,Three lot each environment produce yes.,included,No comments,yZ-9911,686e08165310467dcf1eeab1
Water Create,"384 Johnson Parks, Sanderston, Sao Tome and Principe",384,Johnson Parks,Sanderston,81046,Idaho,Sao Tome and Principe,-51.636759,-52.483595,Let beautiful reality ball group spring tell nothing no.,excluded,No comments,Ki-0771,686e08165310467dcf1eeab1
Film Key,"9624 Wilson Locks, South Jamesfort, Cayman Islands",9624,Wilson Locks,South Jamesfort,21797,Washington,Cayman Islands,-15.791283,58.330079,Dream call down.,included,Popular can.,Eb-5053,686e08165310467dcf1eeab1
Factor Begin,"6917 Pena Grove, West Alyssa, Chile",6917,Pena Grove,West Alyssa,04537,Pennsylvania,Chile,72.422535,41.088817,Give type all suddenly goal scientist find indicate reduce see quite.,included,No comments,rf-0092,686e08165310467dcf1eeab1
Company Nearly,"657 Guzman Mission, Lake Davidberg, Saint Martin",657,Guzman Mission,Lake Davidberg,27480,Tennessee,Saint Martin,19.796639,112.67205,Property third.,excluded,No comments,iJ-7678,686e08165310467dcf1eeab1
Lay Capital,"26346 Kathleen Mountains, Michaelland, Chile",26346,Kathleen Mountains,Michaelland,26374,Alaska,Chile,-23.148406,28.26387,Interesting laugh at star that.,included,No comments,oQ-5018,686e08165310467dcf1eeab1
Carry Admit,"0754 Holly Land, Donaldbury, French Polynesia",0754,Holly Land,Donaldbury,23628,Washington,French Polynesia,48.3165425,-159.138701,Big soon as learn generation like.,included,Democrat present media rate less.,ZI-9886,686e08165310467dcf1eeab1
Really Huge,"5021 Jimenez Street, Davidport, Falkland Islands (Malvinas)",5021,Jimenez Street,Davidport,31820,Rhode Island,Falkland Islands (Malvinas),34.8581355,-159.933824,Hear especially lose.,partially-included,No comments,na-9089,686e08165310467dcf1eeab1
Up Help,"506 Edwards Lane, New Matthew, Bhutan",506,Edwards Lane,New Matthew,87085,Oklahoma,Bhutan,-30.014929,-52.795103,Why here order yes return audience another near whatever.,partially-included,No comments,Lm-8459,686e08165310467dcf1eeab1
Clear Trial,"62807 Young Springs, Dickersonview, Sri Lanka",62807,Young Springs,Dickersonview,93279,Vermont,Sri Lanka,-22.7019275,-57.895227,Anyone discuss close.,partially-included,Front reveal appear sister half food spring step since.,Es-5629,686e08165310467dcf1eeab1
First Say,"5015 Lee Dam, West Chelseymouth, Kenya",5015,Lee Dam,West Chelseymouth,77865,Connecticut,Kenya,32.2844005,-55.103286,Worry lot happen international bring east.,partially-included,No comments,Nf-8503,686e08165310467dcf1eeab1
Bad Know,"3186 Jason Extensions, Nicholasstad, Zimbabwe",3186,Jason Extensions,Nicholasstad,32876,Connecticut,Zimbabwe,-6.0507545,-165.457419,Unit history maintain his determine.,included,No comments,Sb-4031,686e08165310467dcf1eeab1
Actually There,"8733 Rodriguez Center, Dariusfort, Gambia",8733,Rodriguez Center,Dariusfort,34142,Hawaii,Gambia,49.963671,-3.582377,Sport door attorney attack catch.,included,No comments,if-6439,686e08165310467dcf1eeab1
Senior Feeling,"369 Ashley Valley, Anthonyland, Bolivia",369,Ashley Valley,Anthonyland,68058,Colorado,Bolivia,74.1317925,-118.889839,Say hair raise school foot discuss.,included,Wall audience one.,qg-0712,686e08165310467dcf1eeab1
Data East,"1564 Owens Views, Stephenville, France",1564,Owens Views,Stephenville,61429,New York,France,48.90472,2.2469,Hotel than need resource population.,included,Next quality drive lose turn discussion skill.,bk-8853,686e08165310467dcf1eeab1
Serve Standard,"48325 Wells Wall, East Stephen, Angola",48325,Wells Wall,East Stephen,34319,Arkansas,Angola,52.5736365,89.876905,Participant news return class mind.,partially-included,No comments,fU-1486,686e08165310467dcf1eeab1
Wife Agent,"22682 Kara Rapids, West Jenniferchester, Morocco",22682,Kara Rapids,West Jenniferchester,21124,Nevada,Morocco,-9.277689,-143.34534,Water listen it.,included,See bring child increase onto old he relate consumer write.,bI-0832,686e08165310467dcf1eeab1
Authority Particularly,"35141 Clayton Parks, West Nicholas, Zimbabwe",35141,Clayton Parks,West Nicholas,24643,Washington,Zimbabwe,74.434877,-63.230279,Go system myself stay.,included,No comments,ft-5984,686e08165310467dcf1eeab1
Account So,"881 Melinda Drive, Port Craigland, Martinique",881,Melinda Drive,Port Craigland,19355,California,Martinique,19.9097985,-19.056654,Pm political.,excluded,No comments,rg-1455,686e08165310467dcf1eeab1
Special Dark,"136 Travis Fords, West Richardburgh, Ethiopia",136,Travis Fords,West Richardburgh,06044,Michigan,Ethiopia,-40.772018,-178.475292,Send street past.,partially-included,If there hard consumer cut upon wear kid operation.,gv-6481,686e08165310467dcf1eeab1
Suffer A,"49587 Harris Cape, New Kyle, Armenia",49587,Harris Cape,New Kyle,55109,Idaho,Armenia,-24.7524655,143.994359,Other table season campaign street often.,excluded,No comments,nB-4758,686e08165310467dcf1eeab1
Teacher Better,"592 Young Lodge, Kristinashire, Tanzania",592,Young Lodge,Kristinashire,70507,New Hampshire,Tanzania,-7.408596,-11.909513,Their see on you southern natural affect herself.,included,Mouth opportunity people world notice spend.,ag-2440,686e08165310467dcf1eeab1
Local Red,"32543 William Spur, Samuelmouth, Rwanda",32543,William Spur,Samuelmouth,03553,Pennsylvania,Rwanda,45.070829,-38.307378,Base argue still.,included,No comments,NR-4008,686e08165310467dcf1eeab1
Good Economy,"83785 Osborn Keys, Christopherbury, Ethiopia",83785,Osborn Keys,Christopherbury,52234,Mississippi,Ethiopia,-87.987705,125.478773,Catch activity travel nothing bank.,included,No comments,jN-1682,686e08165310467dcf1eeab1
