locationRef,addressInMap,addressBuilding,addressStreet,addressCity,addressPostCode,addressStateProvince,addressCountry,lat,lng,descriptionOfActivities,ghgAssessmentInclusion,comment,subCode,tenantId
Rich Method,"64526 Melissa Meadows, Jasonton, Cook Islands",64526,Melissa Meadows,Jasonton,12527,Georgia,Cook Islands,70.6227825,33.494905,Behavior executive affect event either watch Mr.,included,Water staff.,pQ-7879,686e08165310467dcf1eeab1
Garden Thought,"9856 Nguyen Court, Madelineview, United States Virgin Islands",9856,Nguyen Court,Madelineview,82157,Indiana,United States Virgin Islands,85.4946945,-5.346619,Around unit keep born.,partially-included,No comments,CP-7656,686e08165310467dcf1eeab1
Heavy Matter,"156 Omar Inlet, Andreaport, Venezuela",156,Omar Inlet,Andreaport,70122,Missouri,Venezuela,89.032173,172.277049,Economy level north.,included,Parent religious practice.,Jy-4096,686e08165310467dcf1eeab1
Treatment Sell,"9313 Jennifer Drive, North Kristamouth, Togo",9313,Jennifer Drive,North Kristamouth,72351,Florida,Togo,22.965975,-26.814109,Protect certainly to if.,included,No comments,nN-1923,686e08165310467dcf1eeab1
Current Financial,"8073 Keith Mountain, Davidtown, Somalia",8073,Keith Mountain,Davidtown,18251,South Carolina,Somalia,23.1052345,68.854471,Provide involve animal hold pretty to both.,partially-included,Class growth skin.,ND-5034,686e08165310467dcf1eeab1
Indeed Region,"6005 Morales Bridge, Barrmouth, Solomon Islands",6005,Morales Bridge,Barrmouth,76083,Hawaii,Solomon Islands,-24.621854,-49.627145,Certain without shoulder table position miss when interesting place.,excluded,No comments,Yf-3639,686e08165310467dcf1eeab1
Never Ready,"24668 Banks Pass, Lake Robyn, Tunisia",24668,Banks Pass,Lake Robyn,85387,South Carolina,Tunisia,53.001784,-118.817019,Arm stuff article fight each.,excluded,No comments,xm-4600,686e08165310467dcf1eeab1
Available Win,"7355 Jesse Freeway, Cherylhaven, Montenegro",7355,Jesse Freeway,Cherylhaven,29237,South Dakota,Montenegro,-23.244883,91.78544,Production actually story son.,included,No comments,ps-2286,686e08165310467dcf1eeab1
Music Value,"161 Baker Avenue, Davisville, Micronesia",161,Baker Avenue,Davisville,77255,Virginia,Micronesia,33.5257985,-143.961704,Ago treatment write modern consumer.,excluded,No comments,AY-7460,686e08165310467dcf1eeab1
Production As,"8744 James Ferry, West Kimberlyville, Saint Lucia",8744,James Ferry,West Kimberlyville,88623,Maine,Saint Lucia,60.695227,-120.466111,Campaign thousand.,partially-included,No comments,Mg-4948,686e08165310467dcf1eeab1
That Small,"9933 Sheppard Gardens, New Nicholaston, Italy",9933,Sheppard Gardens,New Nicholaston,83650,Utah,Italy,-56.55954,-125.000074,Price choice bed various.,included,Within base color discussion.,ML-6525,686e08165310467dcf1eeab1
Read Table,"150 Sean Corners, East Josephstad, Mali",150,Sean Corners,East Josephstad,50891,Nebraska,Mali,32.792099,144.670437,Threat mind others.,partially-included,No comments,az-1204,686e08165310467dcf1eeab1
See President,"597 Ana Motorway, Nguyenton, Swaziland",597,Ana Motorway,Nguyenton,71625,Georgia,Swaziland,-86.5241385,41.464703,Entire bar foreign forget ability truth.,partially-included,Month physical then sea.,xd-8474,686e08165310467dcf1eeab1
Either Share,"555 Sharon Harbor, Hollyfort, Philippines",555,Sharon Harbor,Hollyfort,04486,Wisconsin,Philippines,72.556176,157.440387,Live security order today might very body event.,partially-included,No comments,AC-9560,686e08165310467dcf1eeab1
Adult Whose,"64692 Chad Fords, East Carriebury, North Macedonia",64692,Chad Fords,East Carriebury,90488,West Virginia,North Macedonia,-27.3186615,148.475149,That knowledge just small listen wonder.,included,No comments,WM-5170,686e08165310467dcf1eeab1
Firm Building,"820 Lauren Union, Lake Williammouth, Timor-Leste",820,Lauren Union,Lake Williammouth,40075,Oregon,Timor-Leste,-75.009746,-43.229416,Yard nearly director fly since stand could fight central.,partially-included,Song difference check help along itself.,hh-7290,686e08165310467dcf1eeab1
Station Beat,"3262 Michael Throughway, North Terry, Sudan",3262,Michael Throughway,North Terry,06146,Massachusetts,Sudan,-52.3093705,-48.148321,Simply religious ever include form.,included,No comments,gY-1699,686e08165310467dcf1eeab1
Economic History,"4853 Herman Locks, Nathanhaven, Cayman Islands",4853,Herman Locks,Nathanhaven,57491,Montana,Cayman Islands,-19.9345935,125.918762,Suggest cultural together send travel age.,included,Quite tax now it cultural.,LM-0595,686e08165310467dcf1eeab1
Phone Manager,"3654 Justin Views, Travischester, Ukraine",3654,Justin Views,Travischester,22338,Missouri,Ukraine,-65.49572,-168.619912,Sing official.,excluded,No comments,Cn-9101,686e08165310467dcf1eeab1
Ten Second,"226 Melanie Radial, North Kevinmouth, Tonga",226,Melanie Radial,North Kevinmouth,96419,Michigan,Tonga,-89.6150705,65.800991,Away eye good difference.,included,No comments,Is-0574,686e08165310467dcf1eeab1
Really Mind,"24432 James Estate, New Nicole, Ghana",24432,James Estate,New Nicole,15520,Arizona,Ghana,-62.1008895,39.193281,Design attack.,excluded,No comments,NK-6522,686e08165310467dcf1eeab1
Opportunity Wrong,"8521 Singleton Lodge, Rojasview, Guyana",8521,Singleton Lodge,Rojasview,03912,West Virginia,Guyana,-60.776667,74.01929,Speak protect fast lose professional.,included,No comments,fP-8372,686e08165310467dcf1eeab1
Fight Meeting,"233 Williams Ports, East Kaitlynstad, Iran",233,Williams Ports,East Kaitlynstad,01340,Texas,Iran,-23.6791605,71.652905,Pattern same.,partially-included,No comments,Fl-0321,686e08165310467dcf1eeab1
Authority Always,"61410 Smith Cove, West Yesenia, China",61410,Smith Cove,West Yesenia,51516,Georgia,China,67.714784,-131.566161,Analysis before home word gas crime particularly.,partially-included,Season certain vote involve sing field cultural.,Zw-9137,686e08165310467dcf1eeab1
Whom Democratic,"5269 Stephanie Shoal, Meganhaven, Thailand",5269,Stephanie Shoal,Meganhaven,70497,Colorado,Thailand,39.082439,35.706975,President hope turn relationship drive.,excluded,Imagine offer end young away.,kk-6875,686e08165310467dcf1eeab1
Lead Development,"298 Ashley Estates, Harryfurt, Korea",298,Ashley Estates,Harryfurt,22075,Pennsylvania,Korea,-75.8159,37.35099,Light movie music hard.,included,Else affect during employee.,jQ-7461,686e08165310467dcf1eeab1
Make Risk,"66445 Debra Courts, South Kristina, Oman",66445,Debra Courts,South Kristina,20876,Colorado,Oman,-69.424102,-89.196578,Young just law foot win fire.,partially-included,No comments,RF-7592,686e08165310467dcf1eeab1
Expect Arm,"04670 Beth Light, North Jesseburgh, Chile",04670,Beth Light,North Jesseburgh,16666,South Carolina,Chile,22.687413,64.236322,Girl leg whom believe item.,partially-included,Simple another real.,dh-9282,686e08165310467dcf1eeab1
Country Whatever,"05236 Thomas Drive, Jonesview, Venezuela",05236,Thomas Drive,Jonesview,18280,Virginia,Venezuela,-51.8514805,-120.390612,Military foot see east.,excluded,Him describe.,pr-1102,686e08165310467dcf1eeab1
Century Total,"363 Moore Road, East Bethmouth, Tokelau",363,Moore Road,East Bethmouth,24242,Arkansas,Tokelau,-18.628399,156.276301,Quickly he against feel family activity.,partially-included,No comments,SJ-7216,686e08165310467dcf1eeab1
Realize West,"479 Rush Hollow, Port Dawn, Bangladesh",479,Rush Hollow,Port Dawn,16981,Alabama,Bangladesh,-46.1719705,-2.629084,Other decade matter relate least.,included,No comments,hX-7911,686e08165310467dcf1eeab1
Food Blue,"72832 Collins Island, North Andrew, French Polynesia",72832,Collins Island,North Andrew,00718,Kentucky,French Polynesia,-14.9014775,124.614365,Per under seek.,included,No comments,bR-2948,686e08165310467dcf1eeab1
Price Plant,"6552 Melissa Pines, North Jacktown, Martinique",6552,Melissa Pines,North Jacktown,30637,Maine,Martinique,-73.471416,172.011221,Against wife.,included,No comments,gc-2337,686e08165310467dcf1eeab1
Color Available,"99395 Wright Street, South Veronicatown, Netherlands",99395,Wright Street,South Veronicatown,17809,California,Netherlands,-70.6220205,-3.367101,Day suggest describe film sit hotel ago.,included,No comments,pL-2732,686e08165310467dcf1eeab1
Lose Network,"76472 Karen Green, Joeport, Timor-Leste",76472,Karen Green,Joeport,27599,Hawaii,Timor-Leste,75.392907,-154.617349,How.,excluded,No comments,gI-1713,686e08165310467dcf1eeab1
Expert Physical,"06849 Kelsey Brook, Ashleyside, Mexico",06849,Kelsey Brook,Ashleyside,48220,Nevada,Mexico,81.8906065,-31.708453,Difference cost candidate federal owner author order recognize career.,partially-included,Tend various ago hope focus practice modern tonight.,GS-7965,686e08165310467dcf1eeab1
Ever We,"64947 Jordan Port, Brendafurt, Lithuania",64947,Jordan Port,Brendafurt,04905,Rhode Island,Lithuania,-16.03605,60.280429,Game fear future not interesting themselves.,excluded,No comments,GO-0709,686e08165310467dcf1eeab1
Hear Seven,"4715 Ramirez Mount, Pollardport, British Indian Ocean Territory (Chagos Archipelago)",4715,Ramirez Mount,Pollardport,47666,New Jersey,British Indian Ocean Territory (Chagos Archipelago),-57.9715695,6.72919,Wait decide write.,included,Generation behavior himself free.,bH-2906,686e08165310467dcf1eeab1
Dog Certain,"6362 Jessica Greens, Mcdanielfurt, Dominican Republic",6362,Jessica Greens,Mcdanielfurt,02941,Oklahoma,Dominican Republic,73.7904805,116.69262,Arm manager pass present.,included,No comments,rJ-9111,686e08165310467dcf1eeab1
Need Just,"296 Abbott Row, Christinamouth, Singapore",296,Abbott Row,Christinamouth,56269,Mississippi,Singapore,81.3448945,76.597439,Team instead general.,included,Issue.,pH-0308,686e08165310467dcf1eeab1
Himself Plant,"6240 Dyer Corner, West Cathy, Greenland",6240,Dyer Corner,West Cathy,91942,Utah,Greenland,-22.5775,115.193068,What letter go and executive article short appear.,excluded,No comments,QW-0532,686e08165310467dcf1eeab1
Vote Area,"198 Kerr Curve, South Sherry, Panama",198,Kerr Curve,South Sherry,46019,Pennsylvania,Panama,79.7467935,87.472221,Network among throw woman reveal shoulder some tell.,included,No comments,QC-5633,686e08165310467dcf1eeab1
Mother Time,"641 William Lock, West Andrewhaven, Cook Islands",641,William Lock,West Andrewhaven,20532,Vermont,Cook Islands,-33.111971,-9.13809,Significant million easy often husband away.,included,No comments,yQ-1934,686e08165310467dcf1eeab1
Information Dream,"01767 Price Mews, Lake Thomasmouth, Bermuda",01767,Price Mews,Lake Thomasmouth,89578,Indiana,Bermuda,-43.202138,128.414573,Maintain window strategy whatever push hospital.,excluded,No comments,pC-6923,686e08165310467dcf1eeab1
Go Happy,"451 Nash Junction, Judyport, Sudan",451,Nash Junction,Judyport,19699,Georgia,Sudan,12.2523255,165.068399,Life hundred order town.,excluded,No comments,Qn-9495,686e08165310467dcf1eeab1
Investment Sister,"8114 David Key, Williamstad, China",8114,David Key,Williamstad,05296,Connecticut,China,-32.5800475,-122.714082,Within need outside before walk tough.,excluded,No comments,Nc-0517,686e08165310467dcf1eeab1
Maintain Significant,"62357 Jeremy Ferry, North Erica, British Indian Ocean Territory (Chagos Archipelago)",62357,Jeremy Ferry,North Erica,60681,Utah,British Indian Ocean Territory (Chagos Archipelago),27.4159425,124.736363,Really nature experience recently member.,excluded,No comments,mG-3980,686e08165310467dcf1eeab1
Fine Type,"6881 Edward Canyon, Victoriatown, French Guiana",6881,Edward Canyon,Victoriatown,08141,Delaware,French Guiana,-54.192778,98.809089,Right half test.,included,No comments,Bi-2353,686e08165310467dcf1eeab1
Require Between,"71609 Ellis Course, South Jon, Namibia",71609,Ellis Course,South Jon,93252,Nebraska,Namibia,-52.888966,-99.807728,Garden bank piece standard.,partially-included,No comments,UG-4193,686e08165310467dcf1eeab1
How Sometimes,"116 Hill Well, Richardsonburgh, United Kingdom",116,Hill Well,Richardsonburgh,35488,Hawaii,United Kingdom,50.75767,-1.5443,Thing hair teacher course.,partially-included,No comments,TO-6484,686e08165310467dcf1eeab1
Score Billion,"65506 Brittany Village, West Kimberlymouth, Latvia",65506,Brittany Village,West Kimberlymouth,42483,Louisiana,Latvia,16.2076375,-164.508135,Particular again indeed again century ahead everyone through.,included,No comments,Jg-7802,686e08165310467dcf1eeab1
Task During,"46546 Flores Ford, East Eddie, Afghanistan",46546,Flores Ford,East Eddie,18260,Louisiana,Afghanistan,38.806132,-79.572188,Commercial represent less soon final account.,included,No comments,ni-5647,686e08165310467dcf1eeab1
Chance Relate,"414 Thomas Manor, North Heidi, Bulgaria",414,Thomas Manor,North Heidi,65763,Colorado,Bulgaria,-64.3936005,-12.057722,With street name myself.,included,End investment number book save.,Ej-8764,686e08165310467dcf1eeab1
Safe Type,"04654 Matthew Branch, South Lauren, Singapore",04654,Matthew Branch,South Lauren,63246,Oregon,Singapore,-70.8656195,19.009462,Happen alone Republican she girl spend piece very car.,excluded,No comments,rp-9369,686e08165310467dcf1eeab1
Its Expert,"1521 Cole Vista, Kevinshire, Senegal",1521,Cole Vista,Kevinshire,55701,South Dakota,Senegal,-7.2688955,-42.223214,Best consider success require apply stuff step.,included,No comments,WW-8232,686e08165310467dcf1eeab1
Show Spend,"01844 Gina Inlet, Jonestown, Malawi",01844,Gina Inlet,Jonestown,89956,Hawaii,Malawi,24.2806055,-166.773942,Bank everybody capital view.,included,No comments,El-4655,686e08165310467dcf1eeab1
Any Husband,"661 Espinoza Drives, Davismouth, Algeria",661,Espinoza Drives,Davismouth,53061,Kentucky,Algeria,-15.56185,-60.40797,Image four.,included,No comments,tj-4447,686e08165310467dcf1eeab1
Action Land,"84255 Clark Gardens, Galvanberg, American Samoa",84255,Clark Gardens,Galvanberg,91496,Maryland,American Samoa,80.305494,149.336425,People me front.,included,No comments,Qo-7242,686e08165310467dcf1eeab1
Summer Water,"15721 Johnson Turnpike, North Danielleport, Chile",15721,Johnson Turnpike,North Danielleport,84857,Wisconsin,Chile,-53.562558,-175.029803,Perform prove do apply body see.,partially-included,No comments,RB-2939,686e08165310467dcf1eeab1
Produce Nor,"6049 Le Plaza, Ericville, Saint Lucia",6049,Le Plaza,Ericville,25965,Texas,Saint Lucia,3.510794,-110.376958,Carry director government relate long hope moment surface.,included,No comments,oX-4252,686e08165310467dcf1eeab1
Drive There,"3470 Andrews Centers, Joseton, Peru",3470,Andrews Centers,Joseton,58411,Wyoming,Peru,-84.784471,-58.554482,Senior present mission time item.,partially-included,No comments,Jt-9606,686e08165310467dcf1eeab1
You Pretty,"46895 Jennifer Flat, North Judith, Cuba",46895,Jennifer Flat,North Judith,06322,Colorado,Cuba,-21.105414,-160.6291,Speech enough nor character story report light blue doctor.,excluded,No comments,it-2489,686e08165310467dcf1eeab1
Detail Memory,"171 Hicks Summit, New Valeriemouth, Belarus",171,Hicks Summit,New Valeriemouth,52570,Iowa,Belarus,-10.404391,-54.488613,Remain newspaper son energy represent public from million deal.,partially-included,No comments,fV-0197,686e08165310467dcf1eeab1
One Choice,"97137 Thomas Crest, New Kaitlyn, Austria",97137,Thomas Crest,New Kaitlyn,81075,Florida,Austria,-47.152759,103.941583,Nor for option.,excluded,Window rest measure effort player.,zU-6348,686e08165310467dcf1eeab1
Dinner Identify,"261 Ramsey Mall, Amandashire, Luxembourg",261,Ramsey Mall,Amandashire,13739,Georgia,Luxembourg,-45.418404,-92.206466,Memory line their source wide economy forward safe.,included,No comments,RO-8410,686e08165310467dcf1eeab1
Interesting Indeed,"614 Cheyenne Points, Port Anthony, Kiribati",614,Cheyenne Points,Port Anthony,38295,Indiana,Kiribati,-4.5517135,17.837484,Onto bank owner base plan fact age memory others.,excluded,No comments,kX-5846,686e08165310467dcf1eeab1
Nearly Education,"27953 Allen Union, Port Michellechester, Cape Verde",27953,Allen Union,Port Michellechester,90641,Oregon,Cape Verde,-51.0053135,-131.825047,Realize bad fear lawyer.,included,No comments,HR-1321,686e08165310467dcf1eeab1
Yeah Do,"45219 Thomas Coves, Moyerstad, Moldova",45219,Thomas Coves,Moyerstad,14165,Idaho,Moldova,81.1264155,143.684954,Movement company response discover same.,excluded,Half already figure positive service.,Lf-8828,686e08165310467dcf1eeab1
Lay Something,"631 Parrish Isle, Hannahshire, Nauru",631,Parrish Isle,Hannahshire,47771,Massachusetts,Nauru,-2.097418,-104.556082,Drive measure.,partially-included,No comments,dR-9897,686e08165310467dcf1eeab1
Young Reflect,"4437 Jeffrey Walks, Crystalborough, Aruba",4437,Jeffrey Walks,Crystalborough,86373,Minnesota,Aruba,31.868093,-137.301803,Play little need similar make.,included,No comments,UW-8789,686e08165310467dcf1eeab1
Begin While,"91985 Patricia View, Cassidystad, Guinea",91985,Patricia View,Cassidystad,47283,Wisconsin,Guinea,-25.706179,161.523824,Change different hold land result cut car hit foot.,included,No comments,Ey-9500,686e08165310467dcf1eeab1
Machine Good,"46565 Kenneth Estates, North Amandachester, Malawi",46565,Kenneth Estates,North Amandachester,62517,Rhode Island,Malawi,19.96602,-160.233143,Late road when.,partially-included,No comments,Hq-5351,686e08165310467dcf1eeab1
Up Political,"056 Hampton Circle, Hardinbury, Saudi Arabia",056,Hampton Circle,Hardinbury,85797,Iowa,Saudi Arabia,17.358361,34.717795,Blue visit somebody.,partially-included,No comments,zY-8032,686e08165310467dcf1eeab1
Listen Class,"0590 John Circles, Jenningsville, Tanzania",0590,John Circles,Jenningsville,88874,Iowa,Tanzania,-85.2627145,-19.813868,Development always director yes interesting letter.,included,Several around field ok ago.,EV-3587,686e08165310467dcf1eeab1
Arm Affect,"014 Hernandez Rue, Lake Andrewberg, Azerbaijan",014,Hernandez Rue,Lake Andrewberg,80549,Maine,Azerbaijan,-46.268425,-58.587942,Tend million.,partially-included,No comments,vT-1481,686e08165310467dcf1eeab1
Medical System,"868 Francis Crest, East Xavier, Northern Mariana Islands",868,Francis Crest,East Xavier,89655,West Virginia,Northern Mariana Islands,-38.692535,-20.680091,Arrive process capital.,partially-included,No comments,vn-2635,686e08165310467dcf1eeab1
To Character,"98240 Victoria Stream, Vincentchester, Ghana",98240,Victoria Stream,Vincentchester,20122,Utah,Ghana,-8.4233275,-117.567598,Continue billion physical science gun.,partially-included,Plant beat.,dz-6716,686e08165310467dcf1eeab1
With Life,"590 Mark River, Brendaport, Bahamas",590,Mark River,Brendaport,72819,Maryland,Bahamas,-53.478905,-156.458636,In show once particularly garden.,included,No comments,km-5260,686e08165310467dcf1eeab1
Old Dinner,"929 Patricia Wall, Justintown, Uruguay",929,Patricia Wall,Justintown,62345,Massachusetts,Uruguay,-62.830846,-95.431335,Ever yard seek tonight.,excluded,No comments,VJ-2640,686e08165310467dcf1eeab1
Represent Create,"66153 Coffey Wells, Cooperbury, Lesotho",66153,Coffey Wells,Cooperbury,90474,Connecticut,Lesotho,24.3415525,-162.005965,Positive life note mention themselves.,included,No comments,Sx-0659,686e08165310467dcf1eeab1
Night Want,"1259 Parsons Park, South Manuel, Gabon",1259,Parsons Park,South Manuel,99337,West Virginia,Gabon,-62.0811435,-131.906338,Fly dog relationship these.,included,At chair still then firm form likely.,cX-7547,686e08165310467dcf1eeab1
Threat Energy,"84478 Obrien Stream, Port Lisafurt, Paraguay",84478,Obrien Stream,Port Lisafurt,26294,Kentucky,Paraguay,-47.7762775,-33.221518,Movie point memory.,excluded,No comments,BM-4998,686e08165310467dcf1eeab1
First Tv,"814 Nolan Shores, Geraldbury, Croatia",814,Nolan Shores,Geraldbury,36008,Louisiana,Croatia,65.250611,-171.526038,Ground American field seat something may enough.,included,No comments,je-6504,686e08165310467dcf1eeab1
Debate Full,"0490 William Avenue, Shawnfort, Albania",0490,William Avenue,Shawnfort,76971,West Virginia,Albania,31.0752345,-150.464778,Tv popular good.,partially-included,Talk vote training out ahead.,bO-2028,686e08165310467dcf1eeab1
Hope There,"8723 Ray Dam, Elizabethville, Suriname",8723,Ray Dam,Elizabethville,07508,South Carolina,Suriname,60.0941645,-50.456717,Have why Mrs.,partially-included,No comments,Je-8270,686e08165310467dcf1eeab1
Television Character,"7071 Stone Fall, Lake Jacqueline, British Virgin Islands",7071,Stone Fall,Lake Jacqueline,49973,New York,British Virgin Islands,-2.4673115,82.677558,Century system sing discuss actually.,partially-included,No comments,dn-4917,686e08165310467dcf1eeab1
Water Item,"3081 James Centers, Jamieland, Papua New Guinea",3081,James Centers,Jamieland,43952,Massachusetts,Papua New Guinea,36.682019,-151.308063,Until level address.,included,Space lay help election responsibility speech.,zQ-6838,686e08165310467dcf1eeab1
Instead Just,"367 Jasmine Rapid, Vickieshire, Lithuania",367,Jasmine Rapid,Vickieshire,23511,Tennessee,Lithuania,-57.78465,-14.916423,Style executive girl produce similar thank idea try.,included,No comments,hF-4274,686e08165310467dcf1eeab1
Would Never,"110 Paul Harbors, Crystalport, Guernsey",110,Paul Harbors,Crystalport,54358,Alabama,Guernsey,-49.54797,-141.694153,Television allow ahead.,partially-included,No comments,vl-0681,686e08165310467dcf1eeab1
Pressure Number,"9973 Cordova Lodge, Port Stephanie, Somalia",9973,Cordova Lodge,Port Stephanie,60665,Ohio,Somalia,-19.047987,-97.488618,Song hotel professional choice western.,included,They little never news her.,XP-9693,686e08165310467dcf1eeab1
Whole Economic,"36324 Alicia Union, Carneyburgh, Bangladesh",36324,Alicia Union,Carneyburgh,13295,Virginia,Bangladesh,-14.4149785,115.444803,Always year lead.,included,No comments,QS-0160,686e08165310467dcf1eeab1
Remain Protect,"19933 Gould Creek, West Robert, Andorra",19933,Gould Creek,West Robert,74941,Arizona,Andorra,-72.515334,35.289552,Find effect information conference.,excluded,No comments,Pj-2750,686e08165310467dcf1eeab1
Class Evidence,"9540 Aguilar Viaduct, Lake Nicoleside, Bahamas",9540,Aguilar Viaduct,Lake Nicoleside,26293,New York,Bahamas,-5.755921,96.795514,Situation.,excluded,Trip environment consider simply can fine.,qO-4495,686e08165310467dcf1eeab1
Try Make,"85406 Flores Street, Ronnieborough, Bolivia",85406,Flores Street,Ronnieborough,89794,Michigan,Bolivia,-71.191541,-12.326302,Tell speak consider small race.,partially-included,No comments,Zz-3464,686e08165310467dcf1eeab1
Know Common,"0779 Cox Mountains, West Nicolehaven, Qatar",0779,Cox Mountains,West Nicolehaven,61089,Rhode Island,Qatar,36.557437,-87.97103,Must family be.,included,No comments,tC-5955,686e08165310467dcf1eeab1
Shake Generation,"913 Jeffrey Square, Port Matthew, Nepal",913,Jeffrey Square,Port Matthew,87913,Kentucky,Nepal,-11.4833145,56.428498,Mean.,partially-included,Understand short fine role.,jC-2466,686e08165310467dcf1eeab1
Attorney Forget,"680 Hall Village, Keithhaven, Belize",680,Hall Village,Keithhaven,63879,South Dakota,Belize,-81.594472,84.130732,Order man try quite large form late.,partially-included,No comments,va-5162,686e08165310467dcf1eeab1
Discover Process,"4763 Dominique Knolls, Haysstad, Serbia",4763,Dominique Knolls,Haysstad,73550,South Dakota,Serbia,68.3044065,29.010738,Certain attention loss Mrs these.,partially-included,No comments,fb-8361,686e08165310467dcf1eeab1
Rock Property,"04414 Sarah Parkway, Reynoldsfort, Switzerland",04414,Sarah Parkway,Reynoldsfort,73471,South Carolina,Switzerland,21.147634,19.980859,Even be bag son card.,excluded,No comments,Mk-1254,686e08165310467dcf1eeab1
Military Evening,"4346 Villanueva Estate, Natashaside, Antigua and Barbuda",4346,Villanueva Estate,Natashaside,72370,Nevada,Antigua and Barbuda,-37.3684265,-9.100798,Until eye.,partially-included,No comments,YX-3908,686e08165310467dcf1eeab1
Whole Rule,"91042 Sherri Mount, Benjaminmouth, Jersey",91042,Sherri Mount,Benjaminmouth,36518,Missouri,Jersey,30.3391245,-28.769302,Bring air ok between game.,included,Standard end whatever reason report.,NG-5683,686e08165310467dcf1eeab1
Keep Draw,"97999 Sally Lakes, Allisonton, Costa Rica",97999,Sally Lakes,Allisonton,40197,Delaware,Costa Rica,42.6155165,131.568615,Build bill car note brother point build fine what.,included,No comments,vl-6581,686e08165310467dcf1eeab1
Security Section,"640 Brown Path, New Tanyamouth, Azerbaijan",640,Brown Path,New Tanyamouth,37803,New York,Azerbaijan,-39.588807,-84.830425,Interesting cell politics break.,included,No comments,ki-6411,686e08165310467dcf1eeab1
Among Full,"2748 Davis Centers, New Brittanyland, Aruba",2748,Davis Centers,New Brittanyland,00926,Tennessee,Aruba,46.05714,-158.990737,Memory Congress attorney thing position.,partially-included,No comments,bb-4580,686e08165310467dcf1eeab1
Create Rule,"600 Zimmerman Walk, Campbellhaven, Egypt",600,Zimmerman Walk,Campbellhaven,94257,Kansas,Egypt,-1.2517715,118.057779,Indeed dog hotel garden ready.,included,Realize task trip significant her avoid use particularly let.,Yo-1059,686e08165310467dcf1eeab1
Media Impact,"7259 Jones Trail, Port Amberside, United States Virgin Islands",7259,Jones Trail,Port Amberside,23350,New Hampshire,United States Virgin Islands,-8.6696645,-17.252475,Father seek none focus second.,included,Thought past avoid poor section high.,gy-0675,686e08165310467dcf1eeab1
Eight Statement,"15435 Reyes Courts, Mayerbury, Albania",15435,Reyes Courts,Mayerbury,77994,Nebraska,Albania,-21.8149755,-107.47467,Choice law.,included,No comments,lS-5899,686e08165310467dcf1eeab1
Music People,"52053 Carrie Shore, Cowanmouth, Vanuatu",52053,Carrie Shore,Cowanmouth,77623,Illinois,Vanuatu,-4.6291485,-131.425009,Film million air.,excluded,Treatment you fish gun.,Wf-2047,686e08165310467dcf1eeab1
Fire Himself,"031 Vargas Estates, North Kenneth, Gabon",031,Vargas Estates,North Kenneth,86361,Virginia,Gabon,-84.2036635,-88.585619,End father star own increase whom.,excluded,No comments,eD-0321,686e08165310467dcf1eeab1
Feel Poor,"828 Robin Prairie, West Frankhaven, Israel",828,Robin Prairie,West Frankhaven,47819,Vermont,Israel,-85.559847,97.437731,Role remember southern.,partially-included,No comments,Ck-4509,686e08165310467dcf1eeab1
